543,"OMEPRAZOLE AND BICARBONATE (ORAL CAPSULES), SANTARUS/GSK/NORGINE","RAPINEX CAPSULES; SAN-15; ZEGERID CAPSULES; ZEGERID CHEWABLE TABLETS; OMEPRAZOLE; OMEPRAZOLE (IMMEDIATE-RELEASE (2)), SANTARUS; OMEPRAZOLE (ORAL TABLET/CAPSULES, ESOPHAGITIS/DUODENAL ULCER/STOMACH ULCER/GASTROINTESTINAL REFLUX), SALIX/GSK; OMEPRAZOLE (ORAL TABLET/CAPSULES, ESOPHAGITIS/DUODENAL ULCER/STOMACH ULCER/GASTROINTESTINAL REFLUX), SANTARUS/GSK; OMEPRAZOLE AND BICARBONATE (ORAL CAPSULES), SANTARUS/GSK/NORGINE; OMEPRAZOLE/SODIUM BICARBONATE/MAGNESIUM HYDROXIDE (IMMEDIATE-RELEASE BUFFERED TABLET), SANTARUS","RAPINEX CAPSULES; SAN-15; ZEGERID CAPSULES; ZEGERID CHEWABLE TABLETS; OMEPRAZOLE; OMEPRAZOLE (IMMEDIATE-RELEASE (2)), SANTARUS; OMEPRAZOLE (ORAL TABLET/CAPSULES, ESOPHAGITIS/DUODENAL ULCER/STOMACH ULCER/GASTROINTESTINAL REFLUX), SALIX/GSK; OMEPRAZOLE (ORAL TABLET/CAPSULES, ESOPHAGITIS/DUODENAL ULCER/STOMACH ULCER/GASTROINTESTINAL REFLUX), SANTARUS/GSK; OMEPRAZOLE AND BICARBONATE (ORAL CAPSULES), SANTARUS/GSK/NORGINE; OMEPRAZOLE/SODIUM BICARBONATE/MAGNESIUM HYDROXIDE (IMMEDIATE-RELEASE BUFFERED TABLET), SANTARUS","OMEPRAZOLE AND BICARBONATE (ORAL CAPSULES), SANTARUS/GSK/NORGINE",RAPINEX CAPSULES,SAN-15,ZEGERID CAPSULES,ZEGERID CHEWABLE TABLETS,OMEPRAZOLE,"OMEPRAZOLE (IMMEDIATE-RELEASE (2)), SANTARUS","OMEPRAZOLE (ORAL TABLET/CAPSULES, ESOPHAGITIS/DUODENAL ULCER/STOMACH ULCER/GASTROINTESTINAL REFLUX), SALIX/GSK","OMEPRAZOLE (ORAL TABLET/CAPSULES, ESOPHAGITIS/DUODENAL ULCER/STOMACH ULCER/GASTROINTESTINAL REFLUX), SANTARUS/GSK","OMEPRAZOLE AND BICARBONATE (ORAL CAPSULES), SANTARUS/GSK/NORGINE","OMEPRAZOLE/SODIUM BICARBONATE/MAGNESIUM HYDROXIDE (IMMEDIATE-RELEASE BUFFERED TABLET), SANTARUS",,,,,,,,,,,,,,,,,,,,,22032,OMEPRAZOLE,22032,OMEPRAZOLE,22032,OMEPRAZOLE,22032,OMEPRAZOLE,22032,OMEPRAZOLE,22032,OMEPRAZOLE,22032,OMEPRAZOLE,,,,,,,,,2006-02-27T00:00:00Z,2006,2,Omeprazole,stomach ulcer,H+ K+ ATPASE INHIBITOR,ACID PUMP INHIBITOR ANTIULCERANT PRODUCT,CAPSULE FORMULATION; FORMULATION POWDER; ORAL FORMULATION; ORAL QUICK RELEASE FORMULATION; ORAL SUSPENSION FORMULATION; SMALL MOLECULE THERAPEUTIC; TABLET FORMULATION,matched (3),021849,NDA,2005-04-26T00:00:00Z,fda,0,0,0,0,0,,santarus,NASDAQ: SNTS,1,49.2,26.5,1.3,,8,,37.9,7.6,7.6,,,,,acquired by salix in 2014,,,0,https://www.accessdata.fda.gov/scripts/cder/daf/index.cfm?event=overview.process&ApplNo=021849,445,805,531,139,Gastroduodenal ulcer (except hemorrhage),2,0
390,"IOHEXOL (DISSOLVABLE POWDER FORMULATION), INTERPHARMA PRAHA","ORALTAG; IOHEXOL; IOHEXOL (DISSOLVABLE POWDER FORMULATION), INTERPHARMA PRAHA","ORALTAG; IOHEXOL; IOHEXOL (DISSOLVABLE POWDER FORMULATION), INTERPHARMA PRAHA","IOHEXOL (DISSOLVABLE POWDER FORMULATION), INTERPHARMA PRAHA",ORALTAG,IOHEXOL,"IOHEXOL (DISSOLVABLE POWDER FORMULATION), INTERPHARMA PRAHA",,,,,,,,,,,,,,,,,,,,,,,,,,,,205383,IOHEXOL,,,,,,,,,,,,,,,,,,,,,2015-03-26T00:00:00Z,2015,3,Oraltag,gastrointestinal disease,,GASTROINTESTINAL DIAGNOSTIC AGENT; X-RAY CONTRAST MEDIUM,FORMULATION POWDER; IMAGING; ORAL FORMULATION; SOLUTION,matched (3),205383,NDA,2013-03-11T00:00:00Z,fda,0,0,0,0,0,,otsuka,TYO: 4578,1,12023.5,13350.2,13344,13476.7,14733.1,13618.6,8285.8,1672.3,1672.3,,,2008,,acquired by otsuka in 2008,,,0,https://www.accessdata.fda.gov/scripts/cder/daf/index.cfm?event=overview.process&ApplNo=205383,234,129,536,141,Other disorders of stomach and duodenum,2,0
146,CERTOLIZUMAB PEGOL,CDP-870; CIMZIA; PERSTYMAB; CERTOLIZUMAB PEGOL,CDP-870; CIMZIA; PERSTYMAB; CERTOLIZUMAB PEGOL,CERTOLIZUMAB PEGOL,CDP-870,CIMZIA,PERSTYMAB,CERTOLIZUMAB PEGOL,,,,,,,,,,,,,,,,,,,,,,,,,,,125160,CERTOLIZUMAB PEGOL,,,,,,,,,,,,,,,,,,,,,2008-04-22T00:00:00Z,2008,4,Cimzia,crohns disease,TNF ALPHA LIGAND INHIBITOR; TNF ANTAGONIST; TNF BINDING AGENT,ANTI-INFLAMMATORY; SYSTEMIC ANTIPSORIATIC PRODUCT,ANTIBODY FRAGMENT; BIOLOGICAL THERAPEUTIC; FORMULATION POWDER; FREEZE DRYING; MONOCLONAL ANTIBODY HUMANIZED; PEGYLATED FORMULATION; PROTEIN CONJUGATED; PROTEIN RECOMBINANT; SOLUTION; SUBCUTANEOUS FORMULATION,matched (3),125160,BLA,2006-03-02T00:00:00Z,cortellis,0,0,0,0,0,,UCB,EBR: UCB,1,5031.79,5295.05,3366.1,2773.04,2552.13,4251.41,3430.45,1071.75,1071.75,,,,,,,,1,https://www.accessdata.fda.gov/scripts/cder/daf/index.cfm?event=overview.process&ApplNo=125160,8,84,555,144,Regional enteritis and ulcerative colitis,1,0
776,VEDOLIZUMAB,"ENTYVIO; KINTELLES; KYNTELES; LDP-02; MLN-0002; MLN-02; ANTI ALPHA-4/BETA-7 INTEGRIN ANTIBODY, LEUKOSITE; ANTI ALPHA-4/BETA-7 INTEGRIN ANTIBODY, MILLENNIUM/GENENTECH; INTEGRIN ANTAGONISTS, MILLENNIUM/GENENTECH; VEDOLIZUMAB","ENTYVIO; KINTELLES; KYNTELES; LDP-02; MLN-0002; MLN-02; ANTI ALPHA-4/BETA-7 INTEGRIN ANTIBODY, LEUKOSITE; ANTI ALPHA-4/BETA-7 INTEGRIN ANTIBODY, MILLENNIUM/GENENTECH; INTEGRIN ANTAGONISTS, MILLENNIUM/GENENTECH; VEDOLIZUMAB",VEDOLIZUMAB,ENTYVIO,KINTELLES,KYNTELES,LDP-02,MLN-0002,MLN-02,"ANTI ALPHA-4/BETA-7 INTEGRIN ANTIBODY, LEUKOSITE","ANTI ALPHA-4/BETA-7 INTEGRIN ANTIBODY, MILLENNIUM/GENENTECH","INTEGRIN ANTAGONISTS, MILLENNIUM/GENENTECH",VEDOLIZUMAB,,,,,,,,,,,,,,,,,,,,,125476,VEDOLIZUMAB,,,,,,,,,,,,,,,,,,,,,2014-05-20T00:00:00Z,2014,5,Entyvio,crohns disease,INTEGRIN ALPHA-4/BETA-7 ANTAGONIST; MADCAM INHIBITOR,ANTI-INFLAMMATORY; ANTIBACTERIAL; ANTICANCER MONOCLONAL ANTIBODY; ANTIVIRAL; GASTROINTESTINAL SYSTEM AGENT; IMMUNOSUPPRESSANT,BIOLOGICAL THERAPEUTIC; FORMULATION POWDER; FREEZE DRYING; IMMUNOGLOBULIN-G; INFUSION; INTRAVENOUS FORMULATION; MONOCLONAL ANTIBODY HUMANIZED; SUBCUTANEOUS FORMULATION,matched (3),125476,BLA,2013-06-20T00:00:00Z,fda,1,0,1,0,0,,takeda pharmaceuticals,TYO: 4502,1,14563.6,15739.7,18156.3,19052,17491.2,15722.4,10245.4,2976.4,2943.4,,,,,,,,0,https://www.accessdata.fda.gov/scripts/cder/daf/index.cfm?event=overview.process&ApplNo=125476,44,84,555,144,Regional enteritis and ulcerative colitis,1,0
111,"BUDESONIDE (ORAL CONTROLLED-RELEASE GASTROINTESTINAL-SPECIFIC (MMX), ULCERATIVE COLITIS), COSMO/FERRING/SALIX","BUDESONIDE MMX; CB-01-02; CORTIMENT; CORTIMENT MMX; UCERIS; ULTESA; BUDESONIDE; BUDESONIDE (ORAL CONTROLLED-RELEASE GASTROINTESTINAL-SPECIFIC (MMX), ULCERATIVE COLITIS), COSMO/FERRING/SALIX; BUDESONIDE (ORAL CONTROLLED-RELEASE GASTROINTESTINAL-SPECIFIC (MMX), ULCERATIVE COLITIS), COSMO/SANTARUS; BUDESONIDE (ORAL CONTROLLED-RELEASE GASTROINTESTINAL-SPECIFIC, ULCERATIVE COLITIS), COSMO/FERRING","BUDESONIDE MMX; CB-01-02; CORTIMENT; CORTIMENT MMX; UCERIS; ULTESA; BUDESONIDE; BUDESONIDE (ORAL CONTROLLED-RELEASE GASTROINTESTINAL-SPECIFIC (MMX), ULCERATIVE COLITIS), COSMO/FERRING/SALIX; BUDESONIDE (ORAL CONTROLLED-RELEASE GASTROINTESTINAL-SPECIFIC (MMX), ULCERATIVE COLITIS), COSMO/SANTARUS; BUDESONIDE (ORAL CONTROLLED-RELEASE GASTROINTESTINAL-SPECIFIC, ULCERATIVE COLITIS), COSMO/FERRING","BUDESONIDE (ORAL CONTROLLED-RELEASE GASTROINTESTINAL-SPECIFIC (MMX), ULCERATIVE COLITIS), COSMO/FERRING/SALIX",BUDESONIDE MMX,CB-01-02,CORTIMENT,CORTIMENT MMX,UCERIS,ULTESA,BUDESONIDE,"BUDESONIDE (ORAL CONTROLLED-RELEASE GASTROINTESTINAL-SPECIFIC (MMX), ULCERATIVE COLITIS), COSMO/FERRING/SALIX","BUDESONIDE (ORAL CONTROLLED-RELEASE GASTROINTESTINAL-SPECIFIC (MMX), ULCERATIVE COLITIS), COSMO/SANTARUS","BUDESONIDE (ORAL CONTROLLED-RELEASE GASTROINTESTINAL-SPECIFIC, ULCERATIVE COLITIS), COSMO/FERRING",,,,,,,,,,,,,,,,,,,,,203634,BUDESONIDE,,,,,,,,,,,,,,,,,,,,,2013-01-14T00:00:00Z,2013,1,Uceris tablet,ulcerative colitis,,ANTI-INFLAMMATORY; CORTICOSTEROID AGONIST; GASTROINTESTINAL SYSTEM AGENT,CONTROLLED RELEASE FORMULATION; ENTERIC COATED FORMULATION; LOCAL FORMULATION UNSPECIFIED; ORAL FORMULATION; SMALL MOLECULE THERAPEUTIC; STEROID; TABLET FORMULATION,matched (3),203634,NDA,2012-12-14T00:00:00Z,fda,0,0,0,0,0,,santarus,NASDAQ: SNTS,1,384.5,218,118.8,125.4,172.5,130.2,265.3,26.9,26.9,,,,,acquired by salix in 2014,,,0,https://www.accessdata.fda.gov/scripts/cder/daf/index.cfm?event=overview.process&ApplNo=203634,166,337,556,144,Regional enteritis and ulcerative colitis,1,0
112,"BUDESONIDE (RECTAL FOAM, ULCERATIVE COLITIS), DR FALK PHARMA/SALIX/AJINOMOTO/EA PHARMA","AJG-511; AJG-511; BUDENOFALK; BUDENOFALK; UCERIS; BUDESONIDE; BUDESONIDE (RECTAL FOAM, ULCERATIVE COLITIS), DR FALK PHARMA/SALIX/AJINOMOTO/EA PHARMA","AJG-511; AJG-511; BUDENOFALK; BUDENOFALK; UCERIS; BUDESONIDE; BUDESONIDE (RECTAL FOAM, ULCERATIVE COLITIS), DR FALK PHARMA/SALIX/AJINOMOTO/EA PHARMA","BUDESONIDE (RECTAL FOAM, ULCERATIVE COLITIS), DR FALK PHARMA/SALIX/AJINOMOTO/EA PHARMA",AJG-511,AJG-511,BUDENOFALK,BUDENOFALK,UCERIS,BUDESONIDE,"BUDESONIDE (RECTAL FOAM, ULCERATIVE COLITIS), DR FALK PHARMA/SALIX/AJINOMOTO/EA PHARMA",,,,,,,,,,,,,,,,,,,,,,,,203634,BUDESONIDE,,,,,,,,,,,,,,,,,,,,,2014-10-07T00:00:00Z,2014,10,Uceris rectal foam,ulcerative proctitis,GLUCOCORTICOID AGONIST,STEROIDAL ANTI-INFLAMMATORY,RECTAL FOAM FORMULATION; RECTAL FORMULATION; RECTAL FORMULATION LOCAL; SMALL MOLECULE THERAPEUTIC; STEROID,matched (3),205613,NDA,2013-11-15T00:00:00Z,fda,0,0,0,0,0,,salix pharmaceuticals,NASDAQ: SLXP,1,1133.5,913.8,735.4,540.5,337,232.9,833,170.3,170.3,,,,,acquired by valeant in 2015,,,0,https://www.accessdata.fda.gov/scripts/cder/daf/index.cfm?event=overview.process&ApplNo=205613,167,3035,556,144,Regional enteritis and ulcerative colitis,1,0
469,"MESALAZINE (ORAL DELAYED-RELEASE), ALLERGAN","DELZICOL; MESALAMINE; MESALAMINE (DELAYED-RELEASE), ALLERGAN; MESALAMINE (DELAYED-RELEASE), WARNER CHILCOTT; MESALAZINE; MESALAZINE (DELAYED-RELEASE), WARNER CHILCOTT; MESALAZINE (ORAL DELAYED-RELEASE), ALLERGAN","DELZICOL; MESALAMINE; MESALAMINE (DELAYED-RELEASE), ALLERGAN; MESALAMINE (DELAYED-RELEASE), WARNER CHILCOTT; MESALAZINE; MESALAZINE (DELAYED-RELEASE), WARNER CHILCOTT; MESALAZINE (ORAL DELAYED-RELEASE), ALLERGAN","MESALAZINE (ORAL DELAYED-RELEASE), ALLERGAN",DELZICOL,MESALAMINE,"MESALAMINE (DELAYED-RELEASE), ALLERGAN","MESALAMINE (DELAYED-RELEASE), WARNER CHILCOTT",MESALAZINE,"MESALAZINE (DELAYED-RELEASE), WARNER CHILCOTT","MESALAZINE (ORAL DELAYED-RELEASE), ALLERGAN",,,,,,,,,,,,,,,,,,,,,,,,204412,MESALAMINE,,,,,,,,,,,,,,,,,,,,,2013-02-01T00:00:00Z,2013,2,Delzicol,ulcerative colitis,CYCLOOXYGENASE INHIBITOR; LIPOXYGENASE MODULATOR,ANTI-INFLAMMATORY; GASTROINTESTINAL SYSTEM AGENT,CAPSULE FORMULATION; CONTROLLED RELEASE FORMULATION; LOCAL FORMULATION UNSPECIFIED; ORAL FORMULATION; SMALL MOLECULE THERAPEUTIC,matched (3),204412,NDA,2012-07-31T00:00:00Z,fda,1,0,0,0,0,,actavis (allergan plc),NYSE: AGN,1,2602.5,2541,2728,2947,1435.8,938.1,1137.1,190.2,191.3,2409.33333333333,2013-09-30T00:00:00Z,2013,,acquired by actavis (now allergan plc) in 2013,,,0,https://www.accessdata.fda.gov/scripts/cder/daf/index.cfm?event=overview.process&ApplNo=204412,198,337,556,144,Regional enteritis and ulcerative colitis,1,0
470,"MESALAZINE (ORAL SUSTAINED RELEASE, MMX), GIULIANI/SHIRE/MOCHIDA/PACIFIC","GED-0001; LIALDA; MD-0901; MMX MESALAMINE; MESAVANCE; MESAVANCOL; MEZAVANT; MEZAVANT XL; SPD-476; MESALAMINE; MESALAMINE (ORAL SUSTAINED RELEASE, MMX), GIULIANI/SHIRE/MOCHIDA/PACIFIC; MESALAZINE; MESALAZINE (ORAL SUSTAINED RELEASE, MMX), GIULIANI/SHIRE/MOCHIDA/PACIFIC; MESALAZINE MMX; MULTI-MATRIX 5-ASA, GIULIANI/SHIRE","GED-0001; LIALDA; MD-0901; MMX MESALAMINE; MESAVANCE; MESAVANCOL; MEZAVANT; MEZAVANT XL; SPD-476; MESALAMINE; MESALAMINE (ORAL SUSTAINED RELEASE, MMX), GIULIANI/SHIRE/MOCHIDA/PACIFIC; MESALAZINE; MESALAZINE (ORAL SUSTAINED RELEASE, MMX), GIULIANI/SHIRE/MOCHIDA/PACIFIC; MESALAZINE MMX; MULTI-MATRIX 5-ASA, GIULIANI/SHIRE","MESALAZINE (ORAL SUSTAINED RELEASE, MMX), GIULIANI/SHIRE/MOCHIDA/PACIFIC",GED-0001,LIALDA,MD-0901,MMX MESALAMINE,MESAVANCE,MESAVANCOL,MEZAVANT,MEZAVANT XL,SPD-476,MESALAMINE,"MESALAMINE (ORAL SUSTAINED RELEASE, MMX), GIULIANI/SHIRE/MOCHIDA/PACIFIC",MESALAZINE,"MESALAZINE (ORAL SUSTAINED RELEASE, MMX), GIULIANI/SHIRE/MOCHIDA/PACIFIC",MESALAZINE MMX,"MULTI-MATRIX 5-ASA, GIULIANI/SHIRE",,,,,,,,,,,,,,,,22000,MESALAMINE,,,,,,,,,,,,,,,,,,,,,2007-01-16T00:00:00Z,2007,1,Lialda,ulcerative colitis,,ANTI-INFLAMMATORY; GASTROINTESTINAL SYSTEM AGENT; NON-STEROIDAL ANTI-INFLAMMATORY; UNSPECIFIED DRUG TARGET,CONTROLLED RELEASE FORMULATION; DAILY DOSING; ORAL FORMULATION; SMALL MOLECULE THERAPEUTIC; SUSTAINED RELEASE FORMULATION; TABLET FORMULATION,matched (3),022000,NDA,2005-12-21T00:00:00Z,fda,0,0,0,0,0,,shire,NASDAQ: SHPG,1,2436.3,1796.5,1599.3,1363.2,1331.48,1121.1,2116,544.6,544.6,,,,,,,,0,https://www.accessdata.fda.gov/scripts/cder/daf/index.cfm?event=overview.process&ApplNo=022000,433,337,556,144,Regional enteritis and ulcerative colitis,1,0
34,ALVIMOPAN,"ADL-08-0011; ADL-2698; ADL-8-2698; ENTEREG; ENTEREGA; ENTRAREG; L 8-2698; LY-246736; SB-767905; ALVIMOPAN; ALVIMOPAN (USAN); ALVIMOPAN DIHYDRATE; MU-OPIOID ANTAGONIST, ADOLOR; OPIATE ANTAGONIST, ADOLOR","ADL-08-0011; ADL-2698; ADL-8-2698; ENTEREG; ENTEREGA; ENTRAREG; L 8-2698; LY-246736; SB-767905; ALVIMOPAN; ALVIMOPAN (USAN); ALVIMOPAN DIHYDRATE; MU-OPIOID ANTAGONIST, ADOLOR; OPIATE ANTAGONIST, ADOLOR",ALVIMOPAN,ADL-08-0011,ADL-2698,ADL-8-2698,ENTEREG,ENTEREGA,ENTRAREG,L 8-2698,LY-246736,SB-767905,ALVIMOPAN,ALVIMOPAN (USAN),ALVIMOPAN DIHYDRATE,"MU-OPIOID ANTAGONIST, ADOLOR","OPIATE ANTAGONIST, ADOLOR",,,,,,,,,,,,,,,,,21775,ALVIMOPAN,21775,ALVIMOPAN,,,,,,,,,,,,,,,,,,,2008-05-20T00:00:00Z,2008,5,Entereg,ileus,OPIOID RECEPTOR MU ANTAGONIST,GASTROINTESTINAL SYSTEM AGENT,CAPSULE FORMULATION; ORAL FORMULATION; SMALL MOLECULE THERAPEUTIC,matched (3),021775,NDA,2007-08-09T00:00:00Z,fda,0,0,1,0,0,,adolor,NASDAQ: ADLR,1,49.5,9.1,15.1,15.7,25.5,20.7,22,25.4,52.7,,,,,acquired by cubist pharma in 2011,,,1,https://www.accessdata.fda.gov/scripts/cder/daf/index.cfm?event=overview.process&ApplNo=021775,385,1519,560,145,Intestinal obstruction without hernia,1,0
433,LINACLOTIDE,"ASP-0456; CONSTELLA; LINZESS; MD-1100; MM-416775; MM-419447; GUANYLATE CYCLASE TYPE-C RECEPTOR AGONIST (IBS-C/CIC), IRONWOOD/ACTAVIS; GUANYLATE CYCLASE TYPE-C RECEPTOR AGONIST (IBS-C/CIC), IRONWOOD/FOREST; GUANYLATE CYCLASE TYPE-C RECEPTOR AGONIST (IBS-C/CIC), LABORATORIOS ALMIRALL; LINACLOTIDE; LINACLOTIDE ACETATE","ASP-0456; CONSTELLA; LINZESS; MD-1100; MM-416775; MM-419447; GUANYLATE CYCLASE TYPE-C RECEPTOR AGONIST (IBS-C/CIC), IRONWOOD/ACTAVIS; GUANYLATE CYCLASE TYPE-C RECEPTOR AGONIST (IBS-C/CIC), IRONWOOD/FOREST; GUANYLATE CYCLASE TYPE-C RECEPTOR AGONIST (IBS-C/CIC), LABORATORIOS ALMIRALL; LINACLOTIDE; LINACLOTIDE ACETATE",LINACLOTIDE,ASP-0456,CONSTELLA,LINZESS,MD-1100,MM-416775,MM-419447,"GUANYLATE CYCLASE TYPE-C RECEPTOR AGONIST (IBS-C/CIC), IRONWOOD/ACTAVIS","GUANYLATE CYCLASE TYPE-C RECEPTOR AGONIST (IBS-C/CIC), IRONWOOD/FOREST","GUANYLATE CYCLASE TYPE-C RECEPTOR AGONIST (IBS-C/CIC), LABORATORIOS ALMIRALL",LINACLOTIDE,LINACLOTIDE ACETATE,,,,,,,,,,,,,,,,,,,,202811,LINACLOTIDE,,,,,,,,,,,,,,,,,,,,,2012-08-30T00:00:00Z,2012,8,Linzess,constipation,NATRIURETIC PEPTIDE RECEPTOR C AGONIST,ANTICANCER; GASTROPROKINETIC; LAXATIVE,BEAD FORMULATION; BIOLOGICAL THERAPEUTIC; CAPSULE FORMULATION; DRUG COATING; ORAL FORMULATION; ORAL QUICK RELEASE FORMULATION; PEPTIDE; TABLET FORMULATION,matched (3),202811,NDA,2011-08-08T00:00:00Z,fda,0,0,0,0,0,,forest laboratories,NYSE: FRX,1,3341.9,4635.3,4308.4,4060.6,3863.8,3621.4,2653,937.2,937.2,,,,,acquired by actavis (now allergan plc) in 2014,,,1,https://www.accessdata.fda.gov/scripts/cder/daf/index.cfm?event=overview.process&ApplNo=202811,131,404,564,155,Other gastrointestinal disorders,3,0
503,NALOXEGOL,"AZ-13337019 OXALATE; MOVANTIK; MOVENTIG; NKTR-118; NKTR-118 OXALATE; PEG-NALOXOL (ORAL, OPIOID-INDUCED CONSTIPATION), ASTRAZENECA; PEG-NALOXOL (ORAL, OPIOID-INDUCED CONSTIPATION), NEKTAR; NALOXEGOL; NALOXEGOL OXALATE","AZ-13337019 OXALATE; MOVANTIK; MOVENTIG; NKTR-118; NKTR-118 OXALATE; PEG-NALOXOL (ORAL, OPIOID-INDUCED CONSTIPATION), ASTRAZENECA; PEG-NALOXOL (ORAL, OPIOID-INDUCED CONSTIPATION), NEKTAR; NALOXEGOL; NALOXEGOL OXALATE",NALOXEGOL,AZ-13337019 OXALATE,MOVANTIK,MOVENTIG,NKTR-118,NKTR-118 OXALATE,"PEG-NALOXOL (ORAL, OPIOID-INDUCED CONSTIPATION), ASTRAZENECA","PEG-NALOXOL (ORAL, OPIOID-INDUCED CONSTIPATION), NEKTAR",NALOXEGOL,NALOXEGOL OXALATE,,,,,,,,,,,,,,,,,,,,,,204760,NALOXEGOL OXALATE,,,,,,,,,,,,,,,,,,,,,2014-09-16T00:00:00Z,2014,9,Movantik,constipation,OPIOID RECEPTOR MU ANTAGONIST,ANALGESIC,CAPSULE FORMULATION; DAILY DOSING; ORAL FORMULATION; PEGYLATED FORMULATION; SMALL MOLECULE THERAPEUTIC; TABLET FORMULATION,matched (3),204760,NDA,2013-09-16T00:00:00Z,fda,0,0,0,0,0,,astrazeneca,NYSE: AZN,1,26547,25806,27973,33591,33269,32804,20812,5001,5438,,,,,,,,0,https://www.accessdata.fda.gov/scripts/cder/daf/index.cfm?event=overview.process&ApplNo=204760,214,404,564,155,Other gastrointestinal disorders,3,0
239,ELUXADOLINE DIHYDROCHLORIDE,"IBS AGENT (ORAL), FURIEX PHARMACEUTICALS; JNJ-27018966; MUDELTA; TRUBERZI; TRUBERZI; VIBERZI; VIBERZI; ELUXADOLINE; ELUXADOLINE DIHYDROCHLORIDE; OPIOID RECEPTOR MODULATOR (IBS-D), FURIEX PHARMACEUTICALS; OPIOID RECEPTOR MODULATOR (IBS-D), JANSSEN PHARMACEUTICA NV/ PPD; OPIOID RECEPTOR MODULATOR (DIARRHEA-PREDOMINANT IRRITABLE BOWEL SYNDROME), JANSSEN PHARMACEUTICA NV/ PPD","IBS AGENT (ORAL), FURIEX PHARMACEUTICALS; JNJ-27018966; MUDELTA; TRUBERZI; TRUBERZI; VIBERZI; VIBERZI; ELUXADOLINE; ELUXADOLINE DIHYDROCHLORIDE; OPIOID RECEPTOR MODULATOR (IBS-D), FURIEX PHARMACEUTICALS; OPIOID RECEPTOR MODULATOR (IBS-D), JANSSEN PHARMACEUTICA NV/ PPD; OPIOID RECEPTOR MODULATOR (DIARRHEA-PREDOMINANT IRRITABLE BOWEL SYNDROME), JANSSEN PHARMACEUTICA NV/ PPD",ELUXADOLINE DIHYDROCHLORIDE,"IBS AGENT (ORAL), FURIEX PHARMACEUTICALS",JNJ-27018966,MUDELTA,TRUBERZI,TRUBERZI,VIBERZI,VIBERZI,ELUXADOLINE,ELUXADOLINE DIHYDROCHLORIDE,"OPIOID RECEPTOR MODULATOR (IBS-D), FURIEX PHARMACEUTICALS","OPIOID RECEPTOR MODULATOR (IBS-D), JANSSEN PHARMACEUTICA NV/ PPD","OPIOID RECEPTOR MODULATOR (DIARRHEA-PREDOMINANT IRRITABLE BOWEL SYNDROME), JANSSEN PHARMACEUTICA NV/ PPD",,,,,,,,,,,,,,,,,,,206940,ELUXADOLINE,,,,,,,,,,,,,,,,,,,,,2015-05-27T00:00:00Z,2015,5,Viberzi,diarrhea predominant irritable bowel syndrome,OPIOID RECEPTOR DELTA ANTAGONIST; OPIOID RECEPTOR KAPPA AGONIST; OPIOID RECEPTOR MU AGONIST,GASTROINTESTINAL SYSTEM AGENT,DRUG COATING; ORAL FORMULATION; SMALL MOLECULE THERAPEUTIC; TABLET FORMULATION,matched (3),206940,NDA,2014-06-26T00:00:00Z,fda,1,0,1,0,0,,actavis (allergan plc),NYSE: AGN,1,12688.1,4676.5,70.999,40.508,4.49,8.983,11221.3,2067,2358.5,25.6,2014-03-31T00:00:00Z,2014,,acquired by actavis (now allergan plc) in 2014,,,0,https://www.accessdata.fda.gov/scripts/cder/daf/index.cfm?event=overview.process&ApplNo=206940,293,3863,564,155,Other gastrointestinal disorders,3,0
449,LUBIPROSTONE,AMITIZA; RU-0211; SPI-0211; LUBIPROSTONE,AMITIZA; RU-0211; SPI-0211; LUBIPROSTONE,LUBIPROSTONE,AMITIZA,RU-0211,SPI-0211,LUBIPROSTONE,,,,,,,,,,,,,,,,,,,,,,,,,,,21908,LUBIPROSTONE,,,,,,,,,,,,,,,,,,,,,2006-01-31T00:00:00Z,2006,1,Amitiza,constipation,VOLTAGE GATED CHLORIDE CHANNEL 2 STIMULATOR,GASTROPROKINETIC; LAXATIVE,CAPSULE FORMULATION; MICROPARTICLE FORMULATION; ORAL FORMULATION; ORAL LIQUID FORMULATION; SMALL MOLECULE THERAPEUTIC,matched (3),021908,NDA,2005-03-31T00:00:00Z,fda,0,0,0,0,0,,sucampo pharmaceuticals,private,0,59.3,40.2,3.3,4.1,,,37.6,,19.2,,,,,IPO IN 2007,,,0,https://www.accessdata.fda.gov/scripts/cder/daf/index.cfm?event=overview.process&ApplNo=021908,406,404,564,155,Other gastrointestinal disorders,3,0
474,"METHYLNALTREXONE BROMIDE (ORAL), SALIX","MNTX (ORAL), PROGENICS; MOA-728; RELISTOR; METHYLNALTREXONE; METHYLNALTREXONE (ORAL), PROGENICS; METHYLNALTREXONE (ORAL), PROGENICS/WYETH; METHYLNALTREXONE BROMIDE; METHYLNALTREXONE BROMIDE (ORAL), PROGENICS; METHYLNALTREXONE BROMIDE (ORAL), SALIX","MNTX (ORAL), PROGENICS; MOA-728; RELISTOR; METHYLNALTREXONE; METHYLNALTREXONE (ORAL), PROGENICS; METHYLNALTREXONE (ORAL), PROGENICS/WYETH; METHYLNALTREXONE BROMIDE; METHYLNALTREXONE BROMIDE (ORAL), PROGENICS; METHYLNALTREXONE BROMIDE (ORAL), SALIX","METHYLNALTREXONE BROMIDE (ORAL), SALIX","MNTX (ORAL), PROGENICS",MOA-728,RELISTOR,METHYLNALTREXONE,"METHYLNALTREXONE (ORAL), PROGENICS","METHYLNALTREXONE (ORAL), PROGENICS/WYETH",METHYLNALTREXONE BROMIDE,"METHYLNALTREXONE BROMIDE (ORAL), PROGENICS","METHYLNALTREXONE BROMIDE (ORAL), SALIX",,,,,,,,,,,,,,,,,,,,,,21964,METHYLNALTREXONE BROMIDE,,,,,,,,,,,,,,,,,,,,,2016-07-19T00:00:00Z,2016,7,Relistor,constipation,OPIOID RECEPTOR MU ANTAGONIST,,ORAL FORMULATION; SMALL MOLECULE THERAPEUTIC; TABLET FORMULATION,matched (3),208271,NDA,2015-06-19T00:00:00Z,fda,0,0,0,0,0,,valeant pharmaceuticals,NYSE: VRX,1,9674,8200,1133.5,913.8,735.4,540.5,7101,421,421,,,2015,,acquired by valeant in 2015,,,0,https://www.accessdata.fda.gov/scripts/cder/daf/index.cfm?event=overview.process&ApplNo=208271,420,404,564,155,Other gastrointestinal disorders,3,0
475,"METHYLNALTREXONE BROMIDE (SUBCUTANEOUS), PROGENICS/WYETH/ONO/SALIX","MNTX (SC), UNIVERSITY OF CHICAGO/PROGENICS; MOA-728; ONO-3849; RELISTOR (SUBCUTANEOUS), PROGENICS/PFIZER/ONO/SALIX; RELISTOR (SUBCUTANEOUS), PROGENICS/WYETH/ONO/SALIX; METHYLNALTREXONE; METHYLNALTREXONE (SUBCUTANEOUS), PROGENICS; METHYLNALTREXONE (SUBCUTANEOUS, CONSTIPATION), PROGENICS/PFIZER/ONO/SALIX; METHYLNALTREXONE (SUBCUTANEOUS, CONSTIPATION), PROGENICS/WYETH/ONO/SALIX; METHYLNALTREXONE BROMIDE; METHYLNALTREXONE BROMIDE (SUBCUTANEOUS), PROGENICS/WYETH/ONO/SALIX",,,,,,,,,,,,,,,,,,,,,,,,,,,,,,,,,,,,,,,,,,,,,,,,,,,,,,,2008-04-24T00:00:00Z,2008,4,Relistor,constipation,OPIOID RECEPTOR MU ANTAGONIST,LAXATIVE,SMALL MOLECULE THERAPEUTIC; SOLUTION; SUBCUTANEOUS FORMULATION,using only (2),021964,NDA,2007-03-30T00:00:00Z,fda,0,0,0,0,0,,progenics,NASDAQ: PGNX,1,67.7,75.6,69.9,9.5,9.6,7.5,-17.5,,85.1,,,,,,,,0,https://www.accessdata.fda.gov/scripts/cder/daf/index.cfm?event=overview.process&ApplNo=021964,698,404,564,155,Other gastrointestinal disorders,3,0
520,NITROGLYCERIN OINTMENT,ANOGESIC; CELLEGESIC; RECTIV; RECTOGESIC; RUITUOXI; RUITUOXI; NITROGLYCERIN; NITROGLYCERIN OINTMENT,ANOGESIC; CELLEGESIC; RECTIV; RECTOGESIC; RUITUOXI; RUITUOXI; NITROGLYCERIN; NITROGLYCERIN OINTMENT,NITROGLYCERIN OINTMENT,ANOGESIC,CELLEGESIC,RECTIV,RECTOGESIC,RUITUOXI,RUITUOXI,NITROGLYCERIN,NITROGLYCERIN OINTMENT,,,,,,,,,,,,,,,,,,,,,,,18531,NITROGLYCERIN,18531,NITROGLYCERIN,18531,NITROGLYCERIN,21359,NITROGLYCERIN,,,,,,,,,,,,,,,2011-06-21T00:00:00Z,2011,6,Rectiv,anus pain,,ANALGESIC; NO AGONIST; VASODILATOR,DERMATOLOGICAL FORMULATION; EMULSION DERMATOLOGICAL; RECTAL FORMULATION; RECTAL FORMULATION LOCAL; SMALL MOLECULE THERAPEUTIC; TRANSDERMAL FORMULATION,matched (3),021359,NDA,2001-06-22T00:00:00Z,fda,1,0,0,0,0,,kyowa kirin,TSE: 4151,1,4467.4,156.5,127.6,81.7,90.6,75.3,2567.7,622.9,622.6,,,2011,,acquired by kyowa kirin in 2011,,,0,https://www.accessdata.fda.gov/scripts/cder/daf/index.cfm?event=overview.process&ApplNo=021359,366,3648,569,155,Other gastrointestinal disorders,6,0
528,OBETICHOLIC ACID,"6ECDCA; DSP-1747; FXR AGONISTS, INTERCEPT; INT-747; OCA, INTERCEPT; OCALIVA; OCALIVA; UPF-747; FARNESOID X RECEPTOR AGONISTS, INTERCEPT; OBETICHOLIC ACID","6ECDCA; DSP-1747; FXR AGONISTS, INTERCEPT; INT-747; OCA, INTERCEPT; OCALIVA; OCALIVA; UPF-747; FARNESOID X RECEPTOR AGONISTS, INTERCEPT; OBETICHOLIC ACID",OBETICHOLIC ACID,6ECDCA,DSP-1747,"FXR AGONISTS, INTERCEPT",INT-747,"OCA, INTERCEPT",OCALIVA,OCALIVA,UPF-747,"FARNESOID X RECEPTOR AGONISTS, INTERCEPT",OBETICHOLIC ACID,,,,,,,,,,,,,,,,,,,,,207999,OBETICHOLIC ACID,,,,,,,,,,,,,,,,,,,,,2016-05-27T00:00:00Z,2016,5,Ocaliva,primary biliary cirrhosis,FARNESOID X RECEPTOR AGONIST,ANTI-INFLAMMATORY; BILE ACID MODULATOR,DAILY DOSING; FILM COATING; ORAL FORMULATION; SMALL MOLECULE THERAPEUTIC; TABLET FORMULATION,matched (3),207999,NDA,2015-06-27T00:00:00Z,fda,1,1,1,1,0,,intercept pharmaceuticals,NASDAQ: ICPT,1,25,2.8,1.7,1.6,2.4,1.8,25,153.9,153.9,,,,,,,,0,https://www.accessdata.fda.gov/scripts/cder/daf/index.cfm?event=overview.process&ApplNo=207999,319,1995,571,151,Other liver diseases,3,0
192,"DEFIBROTIDE (IV, VENO-OCCLUSIVE DISEASE), GENTIUM","DEFITELIO; DEFIBROTIDE (IV, VENO-OCCLUSIVE DISEASE), GENTIUM; DEFIBROTIDE (IV, VENO-OCCLUSIVE DISEASE), GENTIUM/SIGMA-TAU","DEFITELIO; DEFIBROTIDE (IV, VENO-OCCLUSIVE DISEASE), GENTIUM; DEFIBROTIDE (IV, VENO-OCCLUSIVE DISEASE), GENTIUM/SIGMA-TAU","DEFIBROTIDE (IV, VENO-OCCLUSIVE DISEASE), GENTIUM",DEFITELIO,"DEFIBROTIDE (IV, VENO-OCCLUSIVE DISEASE), GENTIUM","DEFIBROTIDE (IV, VENO-OCCLUSIVE DISEASE), GENTIUM/SIGMA-TAU",,,,,,,,,,,,,,,,,,,,,,,,,,,,208114,DEFIBROTIDE SODIUM,,,,,,,,,,,,,,,,,,,,,2016-03-30T00:00:00Z,2016,3,Defitelio,venous occlusive disease,,ANTICANCER; COAGULATION INHIBITOR; UNSPECIFIED DRUG TARGET; VASOPROTECTANT,BIOLOGICAL THERAPEUTIC; INFUSION; INTRAVENOUS FORMULATION; OLIGONUCLEOTIDE,matched (3),208114,NDA,2015-07-30T00:00:00Z,fda,1,0,1,1,0,,jazz pharmaceuticals,NASDAQ: JAZZ,1,1488,1324.8,1172.9,872.4,586,272.3,1382.6,162.3,261.3,,,,,,,,0,https://www.accessdata.fda.gov/scripts/cder/daf/index.cfm?event=overview.process&ApplNo=208114,329,3413,573,151,Other liver diseases,2,0
