389,IOBENGUANE SULFATE I 123,"123I-IOBENGUANE; 123I-IOBENGUANE SULFATE; ADREVIEW; ADREVIEW; IODINE-123-IOBENGUANE SULFATE; [123I]MIBG (SPECT, IV, NEUROENDOCRINE TUMOR), GE HEALTHCARE; [123I]MIBG (SPECT, IV, NEUROENDOCRINE TUMOR/HEART DISEASE), GE HEALTHCARE; IOBENGUANE (123I); IOBENGUANE SULFATE I 123; NEUROENDOCRINE TUMOR IMAGING AGENT (SPECT, IV), GE HEALTHCARE","123I-IOBENGUANE; 123I-IOBENGUANE SULFATE; ADREVIEW; ADREVIEW; IODINE-123-IOBENGUANE SULFATE; [123I]MIBG (SPECT, IV, NEUROENDOCRINE TUMOR), GE HEALTHCARE; [123I]MIBG (SPECT, IV, NEUROENDOCRINE TUMOR/HEART DISEASE), GE HEALTHCARE; IOBENGUANE (123I); IOBENGUANE SULFATE I 123; NEUROENDOCRINE TUMOR IMAGING AGENT (SPECT, IV), GE HEALTHCARE",IOBENGUANE SULFATE I 123,123I-IOBENGUANE,123I-IOBENGUANE SULFATE,ADREVIEW,ADREVIEW,IODINE-123-IOBENGUANE SULFATE,"[123I]MIBG (SPECT, IV, NEUROENDOCRINE TUMOR), GE HEALTHCARE","[123I]MIBG (SPECT, IV, NEUROENDOCRINE TUMOR/HEART DISEASE), GE HEALTHCARE",IOBENGUANE (123I),IOBENGUANE SULFATE I 123,"NEUROENDOCRINE TUMOR IMAGING AGENT (SPECT, IV), GE HEALTHCARE",,,,,,,,,,,,,,,,,,,,,20084,IOBENGUANE SULFATE I-131,20084,IOBENGUANE SULFATE I-131,22290,IOBENGUANE SULFATE I-123,,,,,,,,,,,,,,,,,2008-09-19T00:00:00Z,2008,9,Adreview,neuroendocrine tumor,,CARDIOVASCULAR DIAGNOSTIC AGENT; ENDOCRINE DIAGNOSTIC AGENT; IMAGING AGENT; NEOPLASM DIAGNOSTIC AGENT; RADIODIAGNOSTIC; SPECT CONTRAST AGENT,IMAGING; INTRAVENOUS FORMULATION; RADIOLABELING,matched (3),022290,NDA,2008-03-20T00:00:00Z,fda,1,0,0,1,0,,GE,NYSE: GE,1,181581,172488,151568,136218,132709,112284,62698,,4400,,,,,,,,0,https://www.accessdata.fda.gov/scripts/cder/daf/index.cfm?event=overview.process&ApplNo=022290,523,1128,209,47,Other and unspecified benign neoplasm,11,0
70,AVELUMAB,"BAVENCIO; MSB-0010718C; MSB0010682; PF-06834635; PF-06834635; ANTI-PD-L1 MAB (SOLID TUMORS), MERCK SERONO; ANTI-PD-L1 MAB (SOLID TUMORS), MERCK SERONO/ PFIZER; AVELUMAB; PROGRAMMED CELL DEATH LIGAND 1 MAB (SOLID TUMORS), MERCK SERONO","BAVENCIO; MSB-0010718C; MSB0010682; PF-06834635; PF-06834635; ANTI-PD-L1 MAB (SOLID TUMORS), MERCK SERONO; ANTI-PD-L1 MAB (SOLID TUMORS), MERCK SERONO/ PFIZER; AVELUMAB; PROGRAMMED CELL DEATH LIGAND 1 MAB (SOLID TUMORS), MERCK SERONO",AVELUMAB,BAVENCIO,MSB-0010718C,MSB0010682,PF-06834635,PF-06834635,"ANTI-PD-L1 MAB (SOLID TUMORS), MERCK SERONO","ANTI-PD-L1 MAB (SOLID TUMORS), MERCK SERONO/ PFIZER",AVELUMAB,"PROGRAMMED CELL DEATH LIGAND 1 MAB (SOLID TUMORS), MERCK SERONO",,,,,,,,,,,,,,,,,,,,,,761049,AVELUMAB,,,,,,,,,,,,,,,,,,,,,2017-03-23T00:00:00Z,2017,3,Bavencio,merkel cell carcinoma,PROGRAMMED CELL DEATH LIGAND 1 INHIBITOR,ANTICANCER; ANTICANCER MONOCLONAL ANTIBODY; IMMUNOMODULATOR,BIOLOGICAL THERAPEUTIC; IMMUNOGLOBULIN-G; INFUSION; INTRAVENOUS FORMULATION; MONOCLONAL ANTIBODY HUMAN,matched (3),761049,BLA,2016-09-23T00:00:00Z,fda,1,1,1,1,1,2015-11-18T00:00:00Z,merck,NYSE: MRK,1,37736,39807,39498,42237,44033,47267,26232,7184,7184,,,,,,1,,0,https://www.accessdata.fda.gov/scripts/cder/daf/index.cfm?event=overview.process&ApplNo=761049,627,3235,209,47,Other and unspecified benign neoplasm,11,0
610,"PROPRANOLOL (ORAL SOLUTION, INFANT HEMANGIOMA), PIERRE FABRE/ MARUHO","HEMANGEOL; HEMANGIOL; PROPRANOLOL; PROPRANOLOL (INFANT HEMANGIOMA), UNIVERSITY OF BORDEAUX; PROPRANOLOL (ORAL SOLUTION, INFANT HEMANGIOMA), PIERRE FABRE; PROPRANOLOL (ORAL SOLUTION, INFANT HEMANGIOMA), PIERRE FABRE/ MARUHO","HEMANGEOL; HEMANGIOL; PROPRANOLOL; PROPRANOLOL (INFANT HEMANGIOMA), UNIVERSITY OF BORDEAUX; PROPRANOLOL (ORAL SOLUTION, INFANT HEMANGIOMA), PIERRE FABRE; PROPRANOLOL (ORAL SOLUTION, INFANT HEMANGIOMA), PIERRE FABRE/ MARUHO","PROPRANOLOL (ORAL SOLUTION, INFANT HEMANGIOMA), PIERRE FABRE/ MARUHO",HEMANGEOL,HEMANGIOL,PROPRANOLOL,"PROPRANOLOL (INFANT HEMANGIOMA), UNIVERSITY OF BORDEAUX","PROPRANOLOL (ORAL SOLUTION, INFANT HEMANGIOMA), PIERRE FABRE","PROPRANOLOL (ORAL SOLUTION, INFANT HEMANGIOMA), PIERRE FABRE/ MARUHO",,,,,,,,,,,,,,,,,,,,,,,,,16419,PROPRANOLOL HYDROCHLORIDE,205410,PROPRANOLOL HYDROCHLORIDE,205410,PROPRANOLOL HYDROCHLORIDE,,,,,,,,,,,,,,,,,2014-03-14T00:00:00Z,2014,3,Hemangeol,hemangioma,BETA ADRENOCEPTOR ANTAGONIST,ANTICANCER; VASOCONSTRICTOR,ORAL FORMULATION; ORAL LIQUID FORMULATION; SMALL MOLECULE THERAPEUTIC,matched (3),205410,NDA,2013-05-17T00:00:00Z,fda,0,0,0,1,0,,pierre fabre,private,0,,,,,,,,,,,,,,,,,0,https://www.accessdata.fda.gov/scripts/cder/daf/index.cfm?event=overview.process&ApplNo=205410,237,1121,228,47,Other and unspecified benign neoplasm,1,0
190,DECITABINE,"5-CDR; 5-AZA-2'-DEOXYCYTIDINE; 5-AZA-2-DEOXYCYTIDINE; 5-AZA-CDR; 5-AZADEOXYCYTIDINE; AZA-DC; DAC; DACOGEN; DAKOGEN; E-7373; IND-50733; JNJ-30979754; NSC-127716; DECITABINE; DECITABINE (INTRAVENOUS, MYELODYSPLASTIC SYNDROMES/ACUTE MYELOID LEUKEMIA), EISAI","5-CDR; 5-AZA-2'-DEOXYCYTIDINE; 5-AZA-2-DEOXYCYTIDINE; 5-AZA-CDR; 5-AZADEOXYCYTIDINE; AZA-DC; DAC; DACOGEN; DAKOGEN; E-7373; IND-50733; JNJ-30979754; NSC-127716; DECITABINE; DECITABINE (INTRAVENOUS, MYELODYSPLASTIC SYNDROMES/ACUTE MYELOID LEUKEMIA), EISAI",DECITABINE,5-CDR,5-AZA-2'-DEOXYCYTIDINE,5-AZA-2-DEOXYCYTIDINE,5-AZA-CDR,5-AZADEOXYCYTIDINE,AZA-DC,DAC,DACOGEN,DAKOGEN,E-7373,IND-50733,JNJ-30979754,NSC-127716,DECITABINE,"DECITABINE (INTRAVENOUS, MYELODYSPLASTIC SYNDROMES/ACUTE MYELOID LEUKEMIA), EISAI",,,,,,,,,,,,,,,,205582,DECITABINE,205582,DECITABINE,205582,DECITABINE,21790,DECITABINE,21790,DECITABINE,,,,,,,,,,,,,2006-05-02T00:00:00Z,2006,5,Dacogen,myelodysplastic syndrome,CYTOSINE DNA METHYLTRANSFERASE INHIBITOR,ANTICANCER; ANTICANCER ANTIMETABOLITE,FORMULATION POWDER; FREEZE DRYING; INFUSION; INTRAVENOUS FORMULATION; SMALL MOLECULE THERAPEUTIC,matched (3),021790,NDA,2005-11-14T00:00:00Z,fda,0,0,1,1,0,,MGI pharma,NASDAQ: MOGN,1,342.8,279.4,195.7,49.4,28.2,33,219.4,100.1,100.1,,,,,acquired by eisai in 2007,,,0,https://www.accessdata.fda.gov/scripts/cder/daf/index.cfm?event=overview.process&ApplNo=021790,387,1272,238,44,Neoplasms of unspecified nature or uncertain behavior,1,1
709,TECHNETIUM TC 99M TILMANOCEPT,"99M-TC-TILMANOCEPT; 99M-TC-TILMANOCEPT; 99MTC-DTPA-MANNOSYL-DEXTRAN; 99MTC-PENTETATE-MANNOSYL-DEXTRAN; CY3-TILMANOCEPT; LYMPHOSEEK; LYMPHATIC TARGETING AGENT, NAVIDEA; LYMPHATIC TARGETING AGENT, NEOPROBE; TECHNETIUM TC 99M TILMANOCEPT; TILMANOCEPT; TILMANOCEPT-CY3","99M-TC-TILMANOCEPT; 99M-TC-TILMANOCEPT; 99MTC-DTPA-MANNOSYL-DEXTRAN; 99MTC-PENTETATE-MANNOSYL-DEXTRAN; CY3-TILMANOCEPT; LYMPHOSEEK; LYMPHATIC TARGETING AGENT, NAVIDEA; LYMPHATIC TARGETING AGENT, NEOPROBE; TECHNETIUM TC 99M TILMANOCEPT; TILMANOCEPT; TILMANOCEPT-CY3",TECHNETIUM TC 99M TILMANOCEPT,99M-TC-TILMANOCEPT,99M-TC-TILMANOCEPT,99MTC-DTPA-MANNOSYL-DEXTRAN,99MTC-PENTETATE-MANNOSYL-DEXTRAN,CY3-TILMANOCEPT,LYMPHOSEEK,"LYMPHATIC TARGETING AGENT, NAVIDEA","LYMPHATIC TARGETING AGENT, NEOPROBE",TECHNETIUM TC 99M TILMANOCEPT,TILMANOCEPT,TILMANOCEPT-CY3,,,,,,,,,,,,,,,,,,,,18141,TECHNETIUM TC-99M MEDRONATE KIT,18141,TECHNETIUM TC-99M MEDRONATE KIT,202207,TECHNETIUM TC-99M TILMANOCEPT,,,,,,,,,,,,,,,,,2013-03-13T00:00:00Z,2013,3,Lymphoseek Kit,breast tumor,MACROPHAGE MANNOSE RECEPTOR 1 MODULATOR,AUTOIMMUNE DIAGNOSTIC AGENT; CARDIOVASCULAR DIAGNOSTIC AGENT; ENDOCRINE DIAGNOSTIC AGENT; GASTROINTESTINAL DIAGNOSTIC AGENT; NEOPLASM DIAGNOSTIC AGENT; RADIODIAGNOSTIC; ULTRASOUND CONTRAST AGENT,FLUORESCENCE; IMAGING; INTRAVENOUS FORMULATION; RADIOLABELING; SMALL MOLECULE THERAPEUTIC; SUBCUTANEOUS FORMULATION; SYSTEMIC FORMULATION UNSPECIFIED,matched (3),202207,NDA,2012-10-30T00:00:00Z,fda,0,0,0,0,0,,navidea biopharmaceuticals,NYSEMKT: NAVB,1,1.1,0.1,0.6,0.6,,7.6,0.8,23.7,23.7,,,,,,,,0,https://www.accessdata.fda.gov/scripts/cder/daf/index.cfm?event=overview.process&ApplNo=202207,65,49,239,44,Neoplasms of unspecified nature or uncertain behavior,1,1
253,ERIBULIN MESYLATE,"B-1793; B-1939; BOLD; E-7389; ER-076349; ER-086526; ER-094039; HALAVEN; NSC-707389; NSC-707390; ANTICANCER AGENT, EISAI/NCI; ERIBULIN; ERIBULIN MESILATE; ERIBULIN MESYLATE; HALICHONDRIN B ANALOGS, EISAI","B-1793; B-1939; BOLD; E-7389; ER-076349; ER-086526; ER-094039; HALAVEN; NSC-707389; NSC-707390; ANTICANCER AGENT, EISAI/NCI; ERIBULIN; ERIBULIN MESILATE; ERIBULIN MESYLATE; HALICHONDRIN B ANALOGS, EISAI",ERIBULIN MESYLATE,B-1793,B-1939,BOLD,E-7389,ER-076349,ER-086526,ER-094039,HALAVEN,NSC-707389,NSC-707390,"ANTICANCER AGENT, EISAI/NCI",ERIBULIN,ERIBULIN MESILATE,ERIBULIN MESYLATE,"HALICHONDRIN B ANALOGS, EISAI",,,,,,,,,,,,,,,,201532,ERIBULIN MESYLATE,,,,,,,,,,,,,,,,,,,,,2010-11-15T00:00:00Z,2010,11,Halaven,breast tumor,,ANTICANCER; CELL CYCLE INHIBITOR; MICROTUBULE INHIBITOR,INTRAVENOUS FORMULATION; NATURAL PRODUCT; SMALL MOLECULE THERAPEUTIC; SOLUTION,matched (3),201532,NDA,2010-03-30T00:00:00Z,fda,1,0,0,0,0,,eisai,TYO: 4523,1,10014.4,8460.4,8530.6,6546.8,5478,4907.5,7961.7,1782,1782,,,,,,1,,0,https://www.accessdata.fda.gov/scripts/cder/daf/index.cfm?event=overview.process&ApplNo=201532,87,49,239,44,Neoplasms of unspecified nature or uncertain behavior,1,1
415,LENVATINIB MESYLATE,E-7080; ER-203492-00; HOPE; KISPLYX; KISPLYX; LENVIMA; LENVIMA; LENVATINIB; LENVATINIB MESYLATE,E-7080; ER-203492-00; HOPE; KISPLYX; KISPLYX; LENVIMA; LENVIMA; LENVATINIB; LENVATINIB MESYLATE,LENVATINIB MESYLATE,E-7080,ER-203492-00,HOPE,KISPLYX,KISPLYX,LENVIMA,LENVIMA,LENVATINIB,LENVATINIB MESYLATE,,,,,,,,,,,,,,,,,,,,,,206947,LENVATINIB MESYLATE,,,,,,,,,,,,,,,,,,,,,2015-02-13T00:00:00Z,2015,2,Lenvima,thyroid tumor,FGF1 RECEPTOR ANTAGONIST; FGF2 RECEPTOR ANTAGONIST; FGF3 RECEPTOR ANTAGONIST; FGF4 RECEPTOR ANTAGONIST; KIT TYROSINE KINASE INHIBITOR; PDGF RECEPTOR ALPHA ANTAGONIST; PDGF RECEPTOR BETA ANTAGONIST; RET TYROSINE KINASE RECEPTOR INHIBITOR; VEGF-1 RECEPTOR ANTAGONIST; VEGF-2 RECEPTOR ANTAGONIST; VEGF-3 RECEPTOR ANTAGONIST,ANGIOGENESIS INHIBITOR; ANTICANCER; ANTICANCER PROTEIN KINASE INHIBITOR,CAPSULE FORMULATION; ORAL FORMULATION; SMALL MOLECULE THERAPEUTIC,matched (3),206947,NDA,2014-08-14T00:00:00Z,fda,1,0,0,1,0,,eisai,TYO: 4523,1,4712.4,4680.9,5612.5,6644.7,8576.2,10014.4,3050.3,1043.2,1043.2,,,,,,1,,0,https://www.accessdata.fda.gov/scripts/cder/daf/index.cfm?event=overview.process&ApplNo=206947,294,1134,239,44,Neoplasms of unspecified nature or uncertain behavior,1,1
350,HEXAMINOLEVULINATE HYDROCHLORIDE,CERVIX; CYSVIEW; HEXVIX; HEXVIX PD; HEXAMINOLEVULINATE; HEXAMINOLEVULINATE HYDROCHLORIDE,,,,,,,,,,,,,,,,,,,,,,,,,,,,,,,,,,,,,,,,,,,,,,,,,,,,,,,2010-05-28T00:00:00Z,2010,5,Cysview,bladder tumor,,ANTICANCER; IMAGING AGENT; NEOPLASM DIAGNOSTIC AGENT; PHOTOSENSITIZER,IMAGING; INTRAVESICAL FORMULATION,using only (2),022555,NDA,2010-03-31T00:00:00Z,fda,1,0,0,0,0,,photocure,OSE: PHO,1,30.5,8.9,5.3,18.2,33.8,8,28.9,15.5,15.5,,,,,,,,0,https://www.accessdata.fda.gov/scripts/cder/daf/index.cfm?event=overview.process&ApplNo=022555,680,42,239,44,Neoplasms of unspecified nature or uncertain behavior,1,1
401,IXABEPILONE,"BMS-247550; BMS-747550; IXEMPRA; NSC-710428; NSC-710468; ANTICANCER AGENTS, BMS/GBF; EPOTHILONE, BMS/GBF; IXABEPILONE",,,,,,,,,,,,,,,,,,,,,,,,,,,,,,,,,,,,,,,,,,,,,,,,,,,,,,,2007-10-16T00:00:00Z,2007,10,Ixempra,breast tumor,TUBULIN MODULATOR,ANTICANCER; CELL CYCLE INHIBITOR; MICROTUBULE INHIBITOR,INFUSION; INTRAVENOUS FORMULATION; SMALL MOLECULE THERAPEUTIC,using only (2),022065,NDA,2007-04-16T00:00:00Z,fda,1,0,0,0,0,,bristol-myers squibb,NYSE: BMY,1,15617,16208,18605,19380,18653,16208,10877,2998,3160,,,,,,1,,1,https://www.accessdata.fda.gov/scripts/cder/daf/index.cfm?event=overview.process&ApplNo=022065,691,49,239,44,Neoplasms of unspecified nature or uncertain behavior,1,1
19,ALBIGLUTIDE,"716155; ALBUGON; EPERZAN; GSK-716155; SYNCRIA; TANZEUM; ALBIGLUTIDE; ALBUMIN-GLP-1 FUSION PROTEIN (DIABETES), HUMAN GENOME SCIENCES; RECOMBINANT GLUCAGON-LIKE PEPTIDE 1 (GLP, LONG ACTING), HUMAN GENOME SCIENCES","716155; ALBUGON; EPERZAN; GSK-716155; SYNCRIA; TANZEUM; ALBIGLUTIDE; ALBUMIN-GLP-1 FUSION PROTEIN (DIABETES), HUMAN GENOME SCIENCES; RECOMBINANT GLUCAGON-LIKE PEPTIDE 1 (GLP, LONG ACTING), HUMAN GENOME SCIENCES",ALBIGLUTIDE,716155,ALBUGON,EPERZAN,GSK-716155,SYNCRIA,TANZEUM,ALBIGLUTIDE,"ALBUMIN-GLP-1 FUSION PROTEIN (DIABETES), HUMAN GENOME SCIENCES","RECOMBINANT GLUCAGON-LIKE PEPTIDE 1 (GLP, LONG ACTING), HUMAN GENOME SCIENCES",,,,,,,,,,,,,,,,,,,,,,125431,ALBIGLUTIDE,,,,,,,,,,,,,,,,,,,,,2014-04-15T00:00:00Z,2014,4,Tanzeum,non-insulin dependent diabetes,GLUCAGON-LIKE PEPTIDE 1 AGONIST,HYPOGLYCEMIC AGENT,BIOLOGICAL THERAPEUTIC; FORMULATION POWDER; FREEZE DRYING; LIQUID FORMULATION; PROTEIN FUSION; PROTEIN RECOMBINANT; SUBCUTANEOUS FORMULATION; SUSTAINED RELEASE FORMULATION; WEEKLY DOSING,matched (3),125431,BLA,2013-01-14T00:00:00Z,fda,0,0,0,0,0,,glaxosmithkline,NYSE: GSK,1,35854.4,43907.9,42959.8,42629,44331.3,45825.1,24441.7,5376.76,5376.8,,,,,,,,1,https://www.accessdata.fda.gov/scripts/cder/daf/index.cfm?event=overview.process&ApplNo=125431,40,837,250,50,Diabetes mellitus with complications,2,0
226,DULAGLUTIDE,"GLP-1 FC; GLP-1 ANALOG (TYPE 2 DIABETES), ELI LILLY; GLP-FC; LY-2189265; TRULICITY; TRULICITY ATEOS; TRULICITY ATEOS; DULAGLUTIDE","GLP-1 FC; GLP-1 ANALOG (TYPE 2 DIABETES), ELI LILLY; GLP-FC; LY-2189265; TRULICITY; TRULICITY ATEOS; TRULICITY ATEOS; DULAGLUTIDE",DULAGLUTIDE,GLP-1 FC,"GLP-1 ANALOG (TYPE 2 DIABETES), ELI LILLY",GLP-FC,LY-2189265,TRULICITY,TRULICITY ATEOS,TRULICITY ATEOS,DULAGLUTIDE,,,,,,,,,,,,,,,,,,,,,,,125469,DULAGLUTIDE,,,,,,,,,,,,,,,,,,,,,2014-09-18T00:00:00Z,2014,9,Trulicity,non-insulin dependent diabetes,GLUCAGON-LIKE PEPTIDE 1 AGONIST,HYPOGLYCEMIC AGENT,ANTIBODY FRAGMENT; BIOLOGICAL THERAPEUTIC; IMMUNOGLOBULIN-G; PROTEIN FUSION; SOLUTION; SUBCUTANEOUS FORMULATION; WEEKLY DOSING,matched (3),125469,BLA,2013-09-18T00:00:00Z,fda,0,0,0,0,0,,eli lilly,NYSE: LLY,1,19615.6,23113.1,22603.4,24286.5,23076,21836,14683.1,4733.6,4733.6,,,,,,,,1,https://www.accessdata.fda.gov/scripts/cder/daf/index.cfm?event=overview.process&ApplNo=125469,43,837,250,50,Diabetes mellitus with complications,2,0
659,"SAXAGLIPTIN + EXTENDED-RELEASE METFORMIN (ORAL, TYPE 2 DIABETES), ASTRAZENECA/BMS","KOMBIGLYZE XR; RIAX-M; METFORMIN HYDROCHLORIDE + ONGLYZA; METFORMIN HYDROCHLORIDE + SAXAGLIPTIN HYDROCHLORIDE; SAXAGLIPTIN + EXTENDED-RELEASE METFORMIN (ORAL, TYPE 2 DIABETES), ASTRAZENECA/BMS; SAXAGLIPTIN + METFORMIN (ORAL, TYPE 2 DIABETES), ASTRAZENECA; SAXAGLIPTIN HYDROCHLORIDE + EXTENDED-RELEASE METFORMIN HYDROCHLORIDE (ORAL, TYPE 2 DIABETES), ASTRAZENECA/BMS; SAXAGLIPTIN HYDROCHLORIDE + METFORMIN HYDROCHLORIDE","KOMBIGLYZE XR; RIAX-M; METFORMIN HYDROCHLORIDE + ONGLYZA; METFORMIN HYDROCHLORIDE + SAXAGLIPTIN HYDROCHLORIDE; SAXAGLIPTIN + EXTENDED-RELEASE METFORMIN (ORAL, TYPE 2 DIABETES), ASTRAZENECA/BMS; SAXAGLIPTIN + METFORMIN (ORAL, TYPE 2 DIABETES), ASTRAZENECA; SAXAGLIPTIN HYDROCHLORIDE + EXTENDED-RELEASE METFORMIN HYDROCHLORIDE (ORAL, TYPE 2 DIABETES), ASTRAZENECA/BMS; SAXAGLIPTIN HYDROCHLORIDE + METFORMIN HYDROCHLORIDE","SAXAGLIPTIN + EXTENDED-RELEASE METFORMIN (ORAL, TYPE 2 DIABETES), ASTRAZENECA/BMS",KOMBIGLYZE XR,RIAX-M,METFORMIN HYDROCHLORIDE + ONGLYZA,METFORMIN HYDROCHLORIDE + SAXAGLIPTIN HYDROCHLORIDE,"SAXAGLIPTIN + EXTENDED-RELEASE METFORMIN (ORAL, TYPE 2 DIABETES), ASTRAZENECA/BMS","SAXAGLIPTIN + METFORMIN (ORAL, TYPE 2 DIABETES), ASTRAZENECA","SAXAGLIPTIN HYDROCHLORIDE + EXTENDED-RELEASE METFORMIN HYDROCHLORIDE (ORAL, TYPE 2 DIABETES), ASTRAZENECA/BMS",SAXAGLIPTIN HYDROCHLORIDE + METFORMIN HYDROCHLORIDE,,,,,,,,,,,,,,,,,,,,,,,200678,METFORMIN HYDROCHLORIDE; SAXAGLIPTIN HYDROCHLORIDE,,,,,,,,,,,,,,,,,,,,,2010-11-05T00:00:00Z,2010,11,Kombiglyze XR,non-insulin dependent diabetes,AMP ACTIVATED PROTEIN KINASE STIMULATOR; DIPEPTIDYL PEPTIDASE IV INHIBITOR,BIGUANIDE ANTIDIABETIC PRODUCT; DPP IV INHIBITOR ANTIDIABETIC PRODUCT; HYPOGLYCEMIC AGENT,DRUG COMBINATION; FILM COATING; ORAL FORMULATION; ORAL SUSTAINED RELEASE FORMULATION; SMALL MOLECULE THERAPEUTIC; TABLET FORMULATION,matched (3),200678,NDA,2009-12-29T00:00:00Z,fda,0,0,0,0,0,,bristol-myers squibb,NYSE: BMY,1,19484,18808,17715,15617,16208,18605,14320,3424,3556,,,,,,,,1,https://www.accessdata.fda.gov/scripts/cder/daf/index.cfm?event=overview.process&ApplNo=200678,78,837,250,50,Diabetes mellitus with complications,2,0
434,LINAGLIPTIN,BI-1356; BI-1356-BS; ONDERO; TRADJENTA; TRAJENTA; TRAYENTA; TRAZENTA; LINAGLIPTIN; LINAGLIPTINE,BI-1356; BI-1356-BS; ONDERO; TRADJENTA; TRAJENTA; TRAYENTA; TRAZENTA; LINAGLIPTIN; LINAGLIPTINE,LINAGLIPTIN,BI-1356,BI-1356-BS,ONDERO,TRADJENTA,TRAJENTA,TRAYENTA,TRAZENTA,LINAGLIPTIN,LINAGLIPTINE,,,,,,,,,,,,,,,,,,,,,,201280,LINAGLIPTIN,,,,,,,,,,,,,,,,,,,,,2011-05-02T00:00:00Z,2011,5,Tradjenta,non-insulin dependent diabetes,DIPEPTIDYL PEPTIDASE IV INHIBITOR,DPP IV INHIBITOR ANTIDIABETIC PRODUCT; HYPOGLYCEMIC AGENT; VULNERARY AGENT,DAILY DOSING; FILM COATING; ORAL FORMULATION; SMALL MOLECULE THERAPEUTIC; TABLET FORMULATION,matched (3),201280,NDA,2010-07-02T00:00:00Z,fda,0,0,0,0,0,,boehringer ingelheim,private,0,,,,,,,,,,,,,,,,,0,https://www.accessdata.fda.gov/scripts/cder/daf/index.cfm?event=overview.process&ApplNo=201280,82,837,250,50,Diabetes mellitus with complications,2,0
435,"LINAGLIPTIN + METFORMIN (ORAL, TYPE 2 DIABETES), BOEHRINGER INGELHEIM/ELI LILLY","BI-1356 + METFORMIN; BI-1356 + METFORMIN (ORAL, TYPE 2 DIABETES), BOEHRINGER INGELHEIM; JENTADUETO; ONDERO + METFORMIN; ONDERO + METFORMIN (ORAL, TYPE 2 DIABETES), BOEHRINGER INGELHEIM; ONDERO MET; ONDERO MET; TRAJENTA DUO; TRAJENTAMET; LINAGLIPTIN + METFORMIN; LINAGLIPTIN + METFORMIN (ORAL, TYPE 2 DIABETES), BOEHRINGER INGELHEIM/ELI LILLY; LINAGLIPTIN + METFORMIN IR; METFORMIN + BI-1356 (ORAL, TYPE 2 DIABETES), BOEHRINGER INGELHEIM; METFORMIN + ONDERO (ORAL, TYPE 2 DIABETES), BOEHRINGER INGELHEIM; METFORMIN + LINAGLIPTIN (ORAL, TYPE 2 DIABETES), BOEHRINGER INGELHEIM","BI-1356 + METFORMIN; BI-1356 + METFORMIN (ORAL, TYPE 2 DIABETES), BOEHRINGER INGELHEIM; JENTADUETO; ONDERO + METFORMIN; ONDERO + METFORMIN (ORAL, TYPE 2 DIABETES), BOEHRINGER INGELHEIM; ONDERO MET; ONDERO MET; TRAJENTA DUO; TRAJENTAMET; LINAGLIPTIN + METFORMIN; LINAGLIPTIN + METFORMIN (ORAL, TYPE 2 DIABETES), BOEHRINGER INGELHEIM/ELI LILLY; LINAGLIPTIN + METFORMIN IR; METFORMIN + BI-1356 (ORAL, TYPE 2 DIABETES), BOEHRINGER INGELHEIM; METFORMIN + ONDERO (ORAL, TYPE 2 DIABETES), BOEHRINGER INGELHEIM; METFORMIN + LINAGLIPTIN (ORAL, TYPE 2 DIABETES), BOEHRINGER INGELHEIM","LINAGLIPTIN + METFORMIN (ORAL, TYPE 2 DIABETES), BOEHRINGER INGELHEIM/ELI LILLY",BI-1356 + METFORMIN,"BI-1356 + METFORMIN (ORAL, TYPE 2 DIABETES), BOEHRINGER INGELHEIM",JENTADUETO,ONDERO + METFORMIN,"ONDERO + METFORMIN (ORAL, TYPE 2 DIABETES), BOEHRINGER INGELHEIM",ONDERO MET,ONDERO MET,TRAJENTA DUO,TRAJENTAMET,LINAGLIPTIN + METFORMIN,"LINAGLIPTIN + METFORMIN (ORAL, TYPE 2 DIABETES), BOEHRINGER INGELHEIM/ELI LILLY",LINAGLIPTIN + METFORMIN IR,"METFORMIN + BI-1356 (ORAL, TYPE 2 DIABETES), BOEHRINGER INGELHEIM","METFORMIN + ONDERO (ORAL, TYPE 2 DIABETES), BOEHRINGER INGELHEIM","METFORMIN + LINAGLIPTIN (ORAL, TYPE 2 DIABETES), BOEHRINGER INGELHEIM",,,,,,,,,,,,,,,,201281,LINAGLIPTIN; METFORMIN HYDROCHLORIDE,,,,,,,,,,,,,,,,,,,,,2012-01-30T00:00:00Z,2012,1,Jentadueto,non-insulin dependent diabetes,AMP ACTIVATED PROTEIN KINASE STIMULATOR; DIPEPTIDYL PEPTIDASE IV INHIBITOR,BIGUANIDE ANTIDIABETIC PRODUCT; DPP IV INHIBITOR ANTIDIABETIC PRODUCT; HYPOGLYCEMIC AGENT,DRUG COMBINATION; FILM COATING; ORAL FORMULATION; SMALL MOLECULE THERAPEUTIC; SUSTAINED RELEASE FORMULATION; TABLET FORMULATION,matched (3),201281,NDA,2011-01-19T00:00:00Z,fda,0,0,0,0,0,,boehringer ingelheim,private,0,,,,,,,,,,,,,,,,,1,https://www.accessdata.fda.gov/scripts/cder/daf/index.cfm?event=overview.process&ApplNo=201281,83,837,250,50,Diabetes mellitus with complications,2,0
304,"FLUOCINOLONE ACETONIDE (INTRAOCULAR IMPLANT, MEDIDUR), ALIMERA/PSIVIDA","DIABETIC RETINOPATHY THERAPY (INTRAOCULAR IMPLANT, MEDIDUR), ALIMERA/PSIVIDA; ILUVIEN; MEDIDUR; MEDIDUR FA; DIABETIC MACULAR EDEMA THERAPY, ALIMERA/CONTROL DELIVERY SYSTEMS; FLUOCINOLONE ACETONIDE; FLUOCINOLONE ACETONIDE (INTRAOCULAR IMPLANT, MEDIDUR), ALIMERA/PSIVIDA","DIABETIC RETINOPATHY THERAPY (INTRAOCULAR IMPLANT, MEDIDUR), ALIMERA/PSIVIDA; ILUVIEN; MEDIDUR; MEDIDUR FA; DIABETIC MACULAR EDEMA THERAPY, ALIMERA/CONTROL DELIVERY SYSTEMS; FLUOCINOLONE ACETONIDE; FLUOCINOLONE ACETONIDE (INTRAOCULAR IMPLANT, MEDIDUR), ALIMERA/PSIVIDA","FLUOCINOLONE ACETONIDE (INTRAOCULAR IMPLANT, MEDIDUR), ALIMERA/PSIVIDA","DIABETIC RETINOPATHY THERAPY (INTRAOCULAR IMPLANT, MEDIDUR), ALIMERA/PSIVIDA",ILUVIEN,MEDIDUR,MEDIDUR FA,"DIABETIC MACULAR EDEMA THERAPY, ALIMERA/CONTROL DELIVERY SYSTEMS",FLUOCINOLONE ACETONIDE,"FLUOCINOLONE ACETONIDE (INTRAOCULAR IMPLANT, MEDIDUR), ALIMERA/PSIVIDA",,,,,,,,,,,,,,,,,,,,,,,,201923,FLUOCINOLONE ACETONIDE,,,,,,,,,,,,,,,,,,,,,2014-09-26T00:00:00Z,2014,9,Iluvien,diabetic macular edema,GLUCOCORTICOID AGONIST,ANTI-INFLAMMATORY; OPHTHALMOLOGICAL CORTICOSTEROID; STEROIDAL ANTI-INFLAMMATORY,CONTROLLED RELEASE FORMULATION; OPHTHALMIC DRUG IMPLANT; OPHTHALMIC FORMULATION; SMALL MOLECULE THERAPEUTIC; STEROID; SUSTAINED RELEASE FORMULATION,matched (3),201923,NDA,2010-06-30T00:00:00Z,fda,1,0,1,0,0,,alimera sciences,NASDAQ: ALIM,1,8.423,1.872,,,,,6.981,11.811,7.6,,,,,,,,0,https://www.accessdata.fda.gov/scripts/cder/daf/index.cfm?event=overview.process&ApplNo=201923,93,2659,250,50,Diabetes mellitus with complications,2,0
672,"SITAGLIPTIN + EXTENDED-RELEASE METFORMIN (ORAL, TYPE 2 DIABETES, MERCK & CO","JANUMET XR; MK-0431A XR; SITAGLIPTIN + EXTENDED-RELEASE METFORMIN (ORAL, TYPE 2 DIABETES, MERCK & CO","JANUMET XR; MK-0431A XR; SITAGLIPTIN + EXTENDED-RELEASE METFORMIN (ORAL, TYPE 2 DIABETES, MERCK & CO","SITAGLIPTIN + EXTENDED-RELEASE METFORMIN (ORAL, TYPE 2 DIABETES, MERCK & CO",JANUMET XR,MK-0431A XR,"SITAGLIPTIN + EXTENDED-RELEASE METFORMIN (ORAL, TYPE 2 DIABETES, MERCK & CO",,,,,,,,,,,,,,,,,,,,,,,,,,,,202270,METFORMIN HYDROCHLORIDE; SITAGLIPTIN PHOSPHATE,,,,,,,,,,,,,,,,,,,,,2012-02-02T00:00:00Z,2012,2,Janumet XR,non-insulin dependent diabetes,AMP ACTIVATED PROTEIN KINASE STIMULATOR; DIPEPTIDYL PEPTIDASE IV INHIBITOR,DPP IV INHIBITOR ANTIDIABETIC PRODUCT; HYPOGLYCEMIC AGENT,DRUG COMBINATION; ORAL FORMULATION; ORAL SUSTAINED RELEASE FORMULATION; SMALL MOLECULE THERAPEUTIC; TABLET FORMULATION,matched (3),202270,NDA,2010-09-23T00:00:00Z,fda,0,0,0,0,0,,merck,NYSE: MRK,1,47267,48047,45987,27428,23850,24197.7,31009,7911,7968,,,,,,,,1,https://www.accessdata.fda.gov/scripts/cder/daf/index.cfm?event=overview.process&ApplNo=202270,108,837,250,50,Diabetes mellitus with complications,2,0
185,DAPAGLIFLOZIN PROPANEDIOL,"APPEBB; BMS-512148; BMS-512148-05; EDISTRIDE; FARXIGA; FORXIGA; OXRA; OXRA; SGLT-2 INHIBITOR (DIABETES), BMS; DAPAGLIFLOZIN; DAPAGLIFLOZIN PROPANEDIOL; DAPAGLIFLOZIN PROPANEDIOL MONOHYDRATE; SODIUM-GLUCOSE COTRANSPORTER INHIBITOR, BRISTOL-MYERS SQUIBB","APPEBB; BMS-512148; BMS-512148-05; EDISTRIDE; FARXIGA; FORXIGA; OXRA; OXRA; SGLT-2 INHIBITOR (DIABETES), BMS; DAPAGLIFLOZIN; DAPAGLIFLOZIN PROPANEDIOL; DAPAGLIFLOZIN PROPANEDIOL MONOHYDRATE; SODIUM-GLUCOSE COTRANSPORTER INHIBITOR, BRISTOL-MYERS SQUIBB",DAPAGLIFLOZIN PROPANEDIOL,APPEBB,BMS-512148,BMS-512148-05,EDISTRIDE,FARXIGA,FORXIGA,OXRA,OXRA,"SGLT-2 INHIBITOR (DIABETES), BMS",DAPAGLIFLOZIN,DAPAGLIFLOZIN PROPANEDIOL,DAPAGLIFLOZIN PROPANEDIOL MONOHYDRATE,"SODIUM-GLUCOSE COTRANSPORTER INHIBITOR, BRISTOL-MYERS SQUIBB",,,,,,,,,,,,,,,,,,202293,DAPAGLIFLOZIN PROPANEDIOL,202293,DAPAGLIFLOZIN PROPANEDIOL,,,,,,,,,,,,,,,,,,,2014-01-08T00:00:00Z,2014,1,Farxiga,non-insulin dependent diabetes,SODIUM GLUCOSE TRANSPORTER-2 INHIBITOR,HYPOGLYCEMIC AGENT,FILM COATING; ORAL FORMULATION; SMALL MOLECULE THERAPEUTIC; TABLET FORMULATION,matched (3),202293,NDA,2010-12-27T00:00:00Z,fda,0,0,0,0,0,,bristol-myers squibb,NYSE: BMY,1,15879,16385,17621,21244,19484,18808,12098,3913,4191,,,,,,,,0,https://www.accessdata.fda.gov/scripts/cder/daf/index.cfm?event=overview.process&ApplNo=202293,111,837,250,50,Diabetes mellitus with complications,2,0
674,"SITAGLIPTIN + SIMVASTATIN (DIABETES), MERCK & CO","JUVICOR; JUVISYNC; MK-0431D; MK-431D; TESOZOR; XELEZOR; SIMVASTATIN + JANUVIA; SIMVASTATIN + SITAGLIPTIN; SIMVASTATIN + SITAGLIPTIN PHOSPHATE; SITAGLIPTIN + SIMVASTATIN (DIABETES), MERCK & CO","JUVICOR; JUVISYNC; MK-0431D; MK-431D; TESOZOR; XELEZOR; SIMVASTATIN + JANUVIA; SIMVASTATIN + SITAGLIPTIN; SIMVASTATIN + SITAGLIPTIN PHOSPHATE; SITAGLIPTIN + SIMVASTATIN (DIABETES), MERCK & CO","SITAGLIPTIN + SIMVASTATIN (DIABETES), MERCK & CO",JUVICOR,JUVISYNC,MK-0431D,MK-431D,TESOZOR,XELEZOR,SIMVASTATIN + JANUVIA,SIMVASTATIN + SITAGLIPTIN,SIMVASTATIN + SITAGLIPTIN PHOSPHATE,"SITAGLIPTIN + SIMVASTATIN (DIABETES), MERCK & CO",,,,,,,,,,,,,,,,,,,,,202343,SIMVASTATIN; SITAGLIPTIN PHOSPHATE,21961,SIMVASTATIN,21961,SIMVASTATIN,21961,SIMVASTATIN,,,,,,,,,,,,,,,2011-10-07T00:00:00Z,2011,10,Juvisync,non-insulin dependent diabetes,DIPEPTIDYL PEPTIDASE IV INHIBITOR; HMG COA REDUCTASE INHIBITOR,DPP IV INHIBITOR ANTIDIABETIC PRODUCT; HYPOGLYCEMIC AGENT; LIPID METABOLISM MODULATOR,DRUG COMBINATION; ORAL FORMULATION; SMALL MOLECULE THERAPEUTIC; TABLET FORMULATION,matched (3),202343,NDA,2010-12-06T00:00:00Z,fda,0,0,0,0,0,,merck,NYSE: MRK,1,48047,45987,27428,23850,24197.7,22636,31731,7742,7880,,,,,,,,0,https://www.accessdata.fda.gov/scripts/cder/daf/index.cfm?event=overview.process&ApplNo=202343,116,837,250,50,Diabetes mellitus with complications,2,0
