119,"BUPRENORPHINE + NALOXONE (OPIOID DEPENDENCE), OREXO","OX-219; ZUBSOLV; BUPRENORPHINE + NALOXONE; BUPRENORPHINE + NALOXONE (OPIOID DEPENDENCE), OREXO","OX-219; ZUBSOLV; BUPRENORPHINE + NALOXONE; BUPRENORPHINE + NALOXONE (OPIOID DEPENDENCE), OREXO","BUPRENORPHINE + NALOXONE (OPIOID DEPENDENCE), OREXO",OX-219,ZUBSOLV,BUPRENORPHINE + NALOXONE,"BUPRENORPHINE + NALOXONE (OPIOID DEPENDENCE), OREXO",,,,,,,,,,,,,,,,,,,,,,,,,,,204242,BUPRENORPHINE HYDROCHLORIDE; NALOXONE HYDROCHLORIDE,,,,,,,,,,,,,,,,,,,,,2013-07-03T00:00:00Z,2013,7,Zubsolv,opiate dependence,MU OPIOID PARTIAL AGONIST; OPIOID PARTIAL AGONIST; OPIOID RECEPTOR ANTAGONIST; OPIOID RECEPTOR KAPPA ANTAGONIST,,BUCCAL FORMULATION SYSTEMIC; DRUG COMBINATION; ORALLY DISINTEGRATING TABLET; SMALL MOLECULE THERAPEUTIC,matched (3),204242,NDA,2012-09-05T00:00:00Z,fda,0,0,0,0,0,,orexo AB,STO: ORX,1,66.8,50.1,29.1,31.3,33,29.7,62.2,37,37,,,,,,,,0,https://www.accessdata.fda.gov/scripts/cder/daf/index.cfm?event=overview.process&ApplNo=204242,187,243,304,661,Substance-related disorders,1,0
116,"BUPRENORPHINE (SUSTAINED RELEASE/SC IMPLANT, PRONEURA), TITAN/ BRAEBURN/ KNIGHT","PROBUPHINE; BUPRENORPHINE; BUPRENORPHINE (PRONEURA DELIVERY SYSTEM), TITAN; BUPRENORPHINE (SUSTAINED RELEASE/SC IMPLANT, PRONEURA), BRAEBURN/ KNIGHT; BUPRENORPHINE (SUSTAINED RELEASE/SC IMPLANT, PRONEURA), TITAN; BUPRENORPHINE (SUSTAINED RELEASE/SC IMPLANT, PRONEURA), TITAN/ BRAEBURN/ KNIGHT; BUPRENORPHINE HYDROCHLORIDE","PROBUPHINE; BUPRENORPHINE; BUPRENORPHINE (PRONEURA DELIVERY SYSTEM), TITAN; BUPRENORPHINE (SUSTAINED RELEASE/SC IMPLANT, PRONEURA), BRAEBURN/ KNIGHT; BUPRENORPHINE (SUSTAINED RELEASE/SC IMPLANT, PRONEURA), TITAN; BUPRENORPHINE (SUSTAINED RELEASE/SC IMPLANT, PRONEURA), TITAN/ BRAEBURN/ KNIGHT; BUPRENORPHINE HYDROCHLORIDE","BUPRENORPHINE (SUSTAINED RELEASE/SC IMPLANT, PRONEURA), TITAN/ BRAEBURN/ KNIGHT",PROBUPHINE,BUPRENORPHINE,"BUPRENORPHINE (PRONEURA DELIVERY SYSTEM), TITAN","BUPRENORPHINE (SUSTAINED RELEASE/SC IMPLANT, PRONEURA), BRAEBURN/ KNIGHT","BUPRENORPHINE (SUSTAINED RELEASE/SC IMPLANT, PRONEURA), TITAN","BUPRENORPHINE (SUSTAINED RELEASE/SC IMPLANT, PRONEURA), TITAN/ BRAEBURN/ KNIGHT",BUPRENORPHINE HYDROCHLORIDE,,,,,,,,,,,,,,,,,,,,,,,,204442,BUPRENORPHINE HYDROCHLORIDE,,,,,,,,,,,,,,,,,,,,,2016-05-26T00:00:00Z,2016,5,Probuphine,opiate dependence,MU OPIOID PARTIAL AGONIST; ORL1 RECEPTOR AGONIST,ANALGESIC,SMALL MOLECULE THERAPEUTIC; SUBCUTANEOUS DRUG IMPLANT; SUBCUTANEOUS FORMULATION,matched (3),204442,NDA,2012-10-27T00:00:00Z,fda,1,0,0,0,0,,titan pharmaceuticals,NASDAQ: TTNP,1,15.1,1.7,3.6,10.5,7.1,4.1,8.9,,6.1,,,,,,,,1,https://www.accessdata.fda.gov/scripts/cder/daf/index.cfm?event=overview.process&ApplNo=204442,201,243,304,661,Substance-related disorders,1,0
118,"BUPRENORPHINE + NALOXONE (HIGH DOSE, BUCCAL (BEMA), OPIOID DEPENDENCE), BIODELIVERY SCIENCES","BNX; BUNAVAIL; BUPRENORPHINE + NALOXONE; BUPRENORPHINE + NALOXONE (HIGH DOSE, BUCCAL (BEMA), OPIOID DEPENDENCE), BIODELIVERY SCIENCES","BNX; BUNAVAIL; BUPRENORPHINE + NALOXONE; BUPRENORPHINE + NALOXONE (HIGH DOSE, BUCCAL (BEMA), OPIOID DEPENDENCE), BIODELIVERY SCIENCES","BUPRENORPHINE + NALOXONE (HIGH DOSE, BUCCAL (BEMA), OPIOID DEPENDENCE), BIODELIVERY SCIENCES",BNX,BUNAVAIL,BUPRENORPHINE + NALOXONE,"BUPRENORPHINE + NALOXONE (HIGH DOSE, BUCCAL (BEMA), OPIOID DEPENDENCE), BIODELIVERY SCIENCES",,,,,,,,,,,,,,,,,,,,,,,,,,,205637,BUPRENORPHINE HYDROCHLORIDE; NALOXONE HYDROCHLORIDE,,,,,,,,,,,,,,,,,,,,,2014-06-06T00:00:00Z,2014,6,Bunavail,opiate dependence,MU OPIOID PARTIAL AGONIST,,BUCCAL FORMULATION SYSTEMIC; DRUG COMBINATION; QUICK RELEASE FORMULATION; SMALL MOLECULE THERAPEUTIC; TRANSMUCOSAL FORMULATION,matched (3),205637,NDA,2013-08-06T00:00:00Z,fda,0,0,0,0,0,,biodelivery sciences,NASDAQ: BDSI,1,26.2,8.6,54.6,3.3,3.4,62.8,-13,,34.3,,,,,,,,0,https://www.accessdata.fda.gov/scripts/cder/daf/index.cfm?event=overview.process&ApplNo=205637,247,243,304,661,Substance-related disorders,1,0
773,VARENICLINE,"CP 526555-18; CP-526555; CHAMPIX; CHANTIX; ALPHA4/BETA2 NICOTINIC RECEPTOR PARTIAL AGONIST, PFIZER; VARENICLINE; VARENICLINE TARTRATE","CP 526555-18; CP-526555; CHAMPIX; CHANTIX; ALPHA4/BETA2 NICOTINIC RECEPTOR PARTIAL AGONIST, PFIZER; VARENICLINE; VARENICLINE TARTRATE",VARENICLINE,CP 526555-18,CP-526555,CHAMPIX,CHANTIX,"ALPHA4/BETA2 NICOTINIC RECEPTOR PARTIAL AGONIST, PFIZER",VARENICLINE,VARENICLINE TARTRATE,,,,,,,,,,,,,,,,,,,,,,,,21928,VARENICLINE TARTRATE,,,,,,,,,,,,,,,,,,,,,2006-05-10T00:00:00Z,2006,5,Chantix,nicotine dependence,NICOTINIC ACH RECEPTOR ALPHA 4 SUBUNIT MODULATOR; NICOTINIC ACH RECEPTOR BETA 2 SUBUNIT MODULATOR; NICOTINIC ACH RECEPTOR PARTIAL AGONIST; NICOTINIC ACETYLCHOLINE RECEPTOR MODULATOR,,FILM COATING; ORAL FORMULATION; SMALL MOLECULE THERAPEUTIC; TABLET FORMULATION,matched (3),021928,NDA,2005-11-09T00:00:00Z,fda,1,0,0,0,0,,pfizer,NYSE: PFE,1,48371,47405,48988,44736,32294,29024,41123,7423,7599,,,,,,,,0,https://www.accessdata.fda.gov/scripts/cder/daf/index.cfm?event=overview.process&ApplNo=021928,411,235,305,661,Substance-related disorders,3,0
448,"LOXAPINE (INHALED (STACCATO), ACUTE AGITATION), ALEXZA","ALXZ-004; AZ-004; ADASUVE; STACCATO LOXAPINE; LOXAPINE; LOXAPINE (INHALED (STACCATO), ACUTE AGITATION), ALEXZA","ALXZ-004; AZ-004; ADASUVE; STACCATO LOXAPINE; LOXAPINE; LOXAPINE (INHALED (STACCATO), ACUTE AGITATION), ALEXZA","LOXAPINE (INHALED (STACCATO), ACUTE AGITATION), ALEXZA",ALXZ-004,AZ-004,ADASUVE,STACCATO LOXAPINE,LOXAPINE,"LOXAPINE (INHALED (STACCATO), ACUTE AGITATION), ALEXZA",,,,,,,,,,,,,,,,,,,,,,,,,22549,LOXAPINE,,,,,,,,,,,,,,,,,,,,,2012-12-21T00:00:00Z,2012,12,Adasuve,agitation,5-HT 2A RECEPTOR ANTAGONIST; DOPAMINE D2 RECEPTOR ANTAGONIST,ANTIPSYCHOTIC; ANXIOLYTIC,AEROSOL FORMULATION INHALANT; INHALANT FORMULATION; POWDER FORMULATION INHALANT; SMALL MOLECULE THERAPEUTIC,matched (3),022549,NDA,2009-12-11T00:00:00Z,fda,0,0,0,0,0,,alexza pharmaceuticals,NASDAQ: ALXA,1,4.07,5.66,42.876,9.514,0.486,,-17.779,,21.8,,,,,,,,1,https://www.accessdata.fda.gov/scripts/cder/daf/index.cfm?event=overview.process&ApplNo=022549,598,3609,307,670,Miscellaneous mental health disorders,3,0
305,"FLUOXETINE (ORAL TABLET, DEPRESSION), EDGEMONT","EDG-003; FLUOXETINE; FLUOXETINE (ORAL TABLET, DEPRESSION), EDGEMONT","EDG-003; FLUOXETINE; FLUOXETINE (ORAL TABLET, DEPRESSION), EDGEMONT","FLUOXETINE (ORAL TABLET, DEPRESSION), EDGEMONT",EDG-003,FLUOXETINE,"FLUOXETINE (ORAL TABLET, DEPRESSION), EDGEMONT",,,,,,,,,,,,,,,,,,,,,,,,,,,,202133,FLUOXETINE HYDROCHLORIDE,,,,,,,,,,,,,,,,,,,,,2011-10-06T00:00:00Z,2011,10,fluoxetine,depression,,5-HT UPTAKE INHIBITOR; ANTIDEPRESSANT,ORAL FORMULATION; SMALL MOLECULE THERAPEUTIC; TABLET FORMULATION,matched (3),202133,NDA,2010-12-09T00:00:00Z,fda,0,0,0,0,0,,edgemont pharmaceuticals,private,0,,,,,,,,,,,,,,,,,1,https://www.accessdata.fda.gov/scripts/cder/daf/index.cfm?event=overview.process&ApplNo=202133,103,93,311,657,Mood disorders,1,0
663,"SELEGILINE TRANSDERMAL SYSTEM, MYLAN","EMSAM; ELDEPRYL TDS; STS, SOMERSET; SELEGILINE; SELEGILINE HYDROCHLORIDE; SELEGILINE TRANSDERMAL PATCH (DEPRESSION), SOMERSET/BMS; SELEGILINE TRANSDERMAL SYSTEM, MYLAN","EMSAM; ELDEPRYL TDS; STS, SOMERSET; SELEGILINE; SELEGILINE HYDROCHLORIDE; SELEGILINE TRANSDERMAL PATCH (DEPRESSION), SOMERSET/BMS; SELEGILINE TRANSDERMAL SYSTEM, MYLAN","SELEGILINE TRANSDERMAL SYSTEM, MYLAN",EMSAM,ELDEPRYL TDS,"STS, SOMERSET",SELEGILINE,SELEGILINE HYDROCHLORIDE,"SELEGILINE TRANSDERMAL PATCH (DEPRESSION), SOMERSET/BMS","SELEGILINE TRANSDERMAL SYSTEM, MYLAN",,,,,,,,,,,,,,,,,,,,,,,,19334,SELEGILINE HYDROCHLORIDE,19334,SELEGILINE HYDROCHLORIDE,21336,SELEGILINE,,,,,,,,,,,,,,,,,2006-02-27T00:00:00Z,2006,2,Emsam,depression,MAO B INHIBITOR,ANTIDEPRESSANT; ANTIPARKINSONIAN; ANXIOLYTIC; NOOTROPIC AGENT,PATCH FORMULATION; SMALL MOLECULE THERAPEUTIC; TRANSDERMAL FORMULATION,matched (3),021336,NDA,2001-05-24T00:00:00Z,fda,0,0,0,0,0,,mylan,NASDAQ: MYL,1,1257.2,1253.4,1360.7,1269.2,1104.1,846.7,627.6,101.4,102.4,,,,1,was 50% owned by mylan until bought out remaining shares in 2008,,,1,https://www.accessdata.fda.gov/scripts/cder/daf/index.cfm?event=overview.process&ApplNo=021336,364,93,311,657,Mood disorders,1,0
754,"TRAZODONE (ORAL ONCE-DAILY, CONTRAMID), LABOPHARM","DDS-04A; OLEPTRO; TRAZODONE CONTRAMID; TRITTICO; TRAZODONE; TRAZODONE (ORAL ONCE-DAILY, CONTRAMID), LABOPHARM","DDS-04A; OLEPTRO; TRAZODONE CONTRAMID; TRITTICO; TRAZODONE; TRAZODONE (ORAL ONCE-DAILY, CONTRAMID), LABOPHARM","TRAZODONE (ORAL ONCE-DAILY, CONTRAMID), LABOPHARM",DDS-04A,OLEPTRO,TRAZODONE CONTRAMID,TRITTICO,TRAZODONE,"TRAZODONE (ORAL ONCE-DAILY, CONTRAMID), LABOPHARM",,,,,,,,,,,,,,,,,,,,,,,,,22411,TRAZODONE HYDROCHLORIDE,,,,,,,,,,,,,,,,,,,,,2010-02-02T00:00:00Z,2010,2,Oleptro,depression,,5-HT UPTAKE INHIBITOR; ANTIDEPRESSANT,ORAL CONTROLLED RELEASE FORMULATION; ORAL FORMULATION; SMALL MOLECULE THERAPEUTIC; TABLET FORMULATION,matched (3),022411,NDA,2008-09-18T00:00:00Z,fda,0,0,0,0,0,,labopharm,TSX: DDS,1,29.5,23.5,17.9,19.2,13.6,2.8,13.9,,9.6,,,,,acquired by paladin labs in 2011,,,1,https://www.accessdata.fda.gov/scripts/cder/daf/index.cfm?event=overview.process&ApplNo=022411,555,93,311,657,Mood disorders,1,0
122,"BUPROPION HYDROCHLORIDE (ORAL EXTENDED-RELEASE, VERSATAB), INTELGENX","CPI-300; FORFIVO XL; INT-0004/2006; INT-004; INT-004/06; BUPROPION; BUPROPION (ORAL EXTENDED-RELEASE, VERSATAB, DEPRESSION), CARY PHARMACEUTICALS/INTELGENX; BUPROPION (ORAL EXTENDED-RELEASE, VERSATAB, DEPRESSION), INTELGENX; BUPROPION HYDROCHLORIDE; BUPROPION HYDROCHLORIDE (ORAL EXTENDED-RELEASE, VERSATAB), INTELGENX","CPI-300; FORFIVO XL; INT-0004/2006; INT-004; INT-004/06; BUPROPION; BUPROPION (ORAL EXTENDED-RELEASE, VERSATAB, DEPRESSION), CARY PHARMACEUTICALS/INTELGENX; BUPROPION (ORAL EXTENDED-RELEASE, VERSATAB, DEPRESSION), INTELGENX; BUPROPION HYDROCHLORIDE; BUPROPION HYDROCHLORIDE (ORAL EXTENDED-RELEASE, VERSATAB), INTELGENX","BUPROPION HYDROCHLORIDE (ORAL EXTENDED-RELEASE, VERSATAB), INTELGENX",CPI-300,FORFIVO XL,INT-0004/2006,INT-004,INT-004/06,BUPROPION,"BUPROPION (ORAL EXTENDED-RELEASE, VERSATAB, DEPRESSION), CARY PHARMACEUTICALS/INTELGENX","BUPROPION (ORAL EXTENDED-RELEASE, VERSATAB, DEPRESSION), INTELGENX",BUPROPION HYDROCHLORIDE,"BUPROPION HYDROCHLORIDE (ORAL EXTENDED-RELEASE, VERSATAB), INTELGENX",,,,,,,,,,,,,,,,,,,,,22497,BUPROPION HYDROCHLORIDE,,,,,,,,,,,,,,,,,,,,,2011-11-10T00:00:00Z,2011,11,Forfivo XL,depression,DOPAMINE RECEPTOR AGONIST; NICOTINIC ACETYLCHOLINE RECEPTOR AGONIST,ANTIDEPRESSANT; NOREPINEPHRINE UPTAKE INHIBITOR,ORAL FORMULATION; ORAL SUSTAINED RELEASE FORMULATION; SMALL MOLECULE THERAPEUTIC; TABLET FORMULATION,matched (3),022497,NDA,2009-03-31T00:00:00Z,fda,0,0,0,0,0,,intelgenx,OTCMKTS: IGXT,1,0.4,0.9,1.3,0.9,0.8,0.3,0.4,1.3,1.5,,,,,,,,1,https://www.accessdata.fda.gov/scripts/cder/daf/index.cfm?event=overview.process&ApplNo=022497,577,93,311,657,Mood disorders,1,0
478,"METHYLPHENIDATE HYDROCHLORIDE (EXTENDED-RELEASE ORAL SUSPENSION, ADHD), NEXTWAVE","NWP-06; QUILLIVANT XR; METHYLPHENIDATE; METHYLPHENIDATE (EXTENDED-RELEASE LIQUID SUSPENSION, ADHD), NEXTWAVE; METHYLPHENIDATE HYDROCHLORIDE; METHYLPHENIDATE HYDROCHLORIDE (EXTENDED-RELEASE ORAL SUSPENSION, ADHD), NEXTWAVE","NWP-06; QUILLIVANT XR; METHYLPHENIDATE; METHYLPHENIDATE (EXTENDED-RELEASE LIQUID SUSPENSION, ADHD), NEXTWAVE; METHYLPHENIDATE HYDROCHLORIDE; METHYLPHENIDATE HYDROCHLORIDE (EXTENDED-RELEASE ORAL SUSPENSION, ADHD), NEXTWAVE","METHYLPHENIDATE HYDROCHLORIDE (EXTENDED-RELEASE ORAL SUSPENSION, ADHD), NEXTWAVE",NWP-06,QUILLIVANT XR,METHYLPHENIDATE,"METHYLPHENIDATE (EXTENDED-RELEASE LIQUID SUSPENSION, ADHD), NEXTWAVE",METHYLPHENIDATE HYDROCHLORIDE,"METHYLPHENIDATE HYDROCHLORIDE (EXTENDED-RELEASE ORAL SUSPENSION, ADHD), NEXTWAVE",,,,,,,,,,,,,,,,,,,,,,,,,202100,METHYLPHENIDATE HYDROCHLORIDE,,,,,,,,,,,,,,,,,,,,,2012-09-27T00:00:00Z,2012,9,Quillvant XR,attention deficit hyperactivity disorder,ALPHA 2 ADRENOCEPTOR AGONIST,DOPAMINE UPTAKE MODULATOR; PSYCHOMODULATOR,FORMULATION POWDER; ORAL FORMULATION; ORAL SUSPENSION FORMULATION; ORAL SUSTAINED RELEASE FORMULATION; SMALL MOLECULE THERAPEUTIC,matched (3),202100,NDA,2010-07-29T00:00:00Z,fda,0,0,0,0,0,,pfizer,NYSE: PFE,1,54657,,,,,,45164,6705,7482,,,,,acquired by pfizer in 2012,,,1,https://www.accessdata.fda.gov/scripts/cder/daf/index.cfm?event=overview.process&ApplNo=202100,100,34,314,652,"Attention-deficit, conduct, and disruptive behavior disorders",1,0
36,"AMFETAMINE POLISTIREX (EXTENDED RELEASE, ORALLY DISINTEGRATING TABLET, RDIM, ATTENTION DEFICIT HYPERACTIVITY DISORDER), NEOS","ADZENYS XR-ODT; NT-0202; AMFETAMINE; AMFETAMINE POLISTIREX (EXTENDED RELEASE, ORALLY DISINTEGRATING TABLET, RDIM, ATTENTION DEFICIT HYPERACTIVITY DISORDER), NEOS; AMPHETAMINE; AMPHETAMINE XR-ODT; AMPHETAMINE POLISTIREX (EXTENDED RELEASE, ORALLY DISINTEGRATING TABLET, RDIM, ATTENTION DEFICIT HYPERACTIVITY DISORDER), NEOS","ADZENYS XR-ODT; NT-0202; AMFETAMINE; AMFETAMINE POLISTIREX (EXTENDED RELEASE, ORALLY DISINTEGRATING TABLET, RDIM, ATTENTION DEFICIT HYPERACTIVITY DISORDER), NEOS; AMPHETAMINE; AMPHETAMINE XR-ODT; AMPHETAMINE POLISTIREX (EXTENDED RELEASE, ORALLY DISINTEGRATING TABLET, RDIM, ATTENTION DEFICIT HYPERACTIVITY DISORDER), NEOS","AMFETAMINE POLISTIREX (EXTENDED RELEASE, ORALLY DISINTEGRATING TABLET, RDIM, ATTENTION DEFICIT HYPERACTIVITY DISORDER), NEOS",ADZENYS XR-ODT,NT-0202,AMFETAMINE,"AMFETAMINE POLISTIREX (EXTENDED RELEASE, ORALLY DISINTEGRATING TABLET, RDIM, ATTENTION DEFICIT HYPERACTIVITY DISORDER), NEOS",AMPHETAMINE,AMPHETAMINE XR-ODT,"AMPHETAMINE POLISTIREX (EXTENDED RELEASE, ORALLY DISINTEGRATING TABLET, RDIM, ATTENTION DEFICIT HYPERACTIVITY DISORDER), NEOS",,,,,,,,,,,,,,,,,,,,,,,,204326,AMPHETAMINE,,,,,,,,,,,,,,,,,,,,,2016-01-27T00:00:00Z,2016,1,Adzenys XR-ODT,attention deficit hyperactivity disorder,ADRENOCEPTOR AGONIST,,ORAL FORMULATION; ORAL SUSTAINED RELEASE FORMULATION; ORALLY DISINTEGRATING TABLET; SMALL MOLECULE THERAPEUTIC; TABLET FORMULATION,matched (3),204326,NDA,2012-12-27T00:00:00Z,fda,0,0,0,0,0,,neos therapeutics,NASDAQ: NEOS,1,9.2,3.8,0.8,1,,,-2.3,12.2,12.2,,,,,,,,1,https://www.accessdata.fda.gov/scripts/cder/daf/index.cfm?event=overview.process&ApplNo=204326,193,34,314,652,"Attention-deficit, conduct, and disruptive behavior disorders",1,0
479,"METHYLPHENIDATE HYDROCHLORIDE (ONCE-DAILY ORAL, ADHD), PURDUE PHARMA/RHODES PHARMACEUTICALS","APTENSIO XR; APTENSIO XR; BIPHENTIN; BIPHENTIN; MPH-MLR; MPH-MLR; METHYLPHENIDATE; METHYLPHENIDATE HYDROCHLORIDE; METHYLPHENIDATE HYDROCHLORIDE (ONCE-DAILY ORAL, ADHD), PURDUE PHARMA/RHODES PHARMACEUTICALS","APTENSIO XR; APTENSIO XR; BIPHENTIN; BIPHENTIN; MPH-MLR; MPH-MLR; METHYLPHENIDATE; METHYLPHENIDATE HYDROCHLORIDE; METHYLPHENIDATE HYDROCHLORIDE (ONCE-DAILY ORAL, ADHD), PURDUE PHARMA/RHODES PHARMACEUTICALS","METHYLPHENIDATE HYDROCHLORIDE (ONCE-DAILY ORAL, ADHD), PURDUE PHARMA/RHODES PHARMACEUTICALS",APTENSIO XR,APTENSIO XR,BIPHENTIN,BIPHENTIN,MPH-MLR,MPH-MLR,METHYLPHENIDATE,METHYLPHENIDATE HYDROCHLORIDE,"METHYLPHENIDATE HYDROCHLORIDE (ONCE-DAILY ORAL, ADHD), PURDUE PHARMA/RHODES PHARMACEUTICALS",,,,,,,,,,,,,,,,,,,,,,205831,METHYLPHENIDATE HYDROCHLORIDE,205831,METHYLPHENIDATE HYDROCHLORIDE,,,,,,,,,,,,,,,,,,,2015-04-17T00:00:00Z,2015,4,Aptensio XR,attention deficit hyperactivity disorder,,PSYCHOSTIMULANT; UNSPECIFIED DRUG TARGET,CAPSULE FORMULATION; ORAL FORMULATION; ORAL QUICK RELEASE FORMULATION; ORAL SUSTAINED RELEASE FORMULATION; SMALL MOLECULE THERAPEUTIC,matched (3),205831,NDA,2014-06-18T00:00:00Z,fda,0,0,0,0,0,,rhodes pharmaceuticals,private,0,,,,,,,,,,,,,,,,,1,https://www.accessdata.fda.gov/scripts/cder/daf/index.cfm?event=overview.process&ApplNo=205831,259,34,314,652,"Attention-deficit, conduct, and disruptive behavior disorders",1,0
477,"METHYLPHENIDATE HYDROCHLORIDE (EXTENDED-RELEASE CHEWABLE TABLET, ADHD), NEXTWAVE/PFIZER","NWP-09; QUILLICHEW ER; QUILLICHEW ER; METHYLPHENIDATE; METHYLPHENIDATE (EXTENDED-RELEASE CHEWABLE TABLET, ADHD), NEXTWAVE; METHYLPHENIDATE HYDROCHLORIDE; METHYLPHENIDATE HYDROCHLORIDE (EXTENDED-RELEASE CHEWABLE TABLET, ADHD), NEXTWAVE/PFIZER","NWP-09; QUILLICHEW ER; QUILLICHEW ER; METHYLPHENIDATE; METHYLPHENIDATE (EXTENDED-RELEASE CHEWABLE TABLET, ADHD), NEXTWAVE; METHYLPHENIDATE HYDROCHLORIDE; METHYLPHENIDATE HYDROCHLORIDE (EXTENDED-RELEASE CHEWABLE TABLET, ADHD), NEXTWAVE/PFIZER","METHYLPHENIDATE HYDROCHLORIDE (EXTENDED-RELEASE CHEWABLE TABLET, ADHD), NEXTWAVE/PFIZER",NWP-09,QUILLICHEW ER,QUILLICHEW ER,METHYLPHENIDATE,"METHYLPHENIDATE (EXTENDED-RELEASE CHEWABLE TABLET, ADHD), NEXTWAVE",METHYLPHENIDATE HYDROCHLORIDE,"METHYLPHENIDATE HYDROCHLORIDE (EXTENDED-RELEASE CHEWABLE TABLET, ADHD), NEXTWAVE/PFIZER",,,,,,,,,,,,,,,,,,,,,,,,207960,METHYLPHENIDATE HYDROCHLORIDE,,,,,,,,,,,,,,,,,,,,,2015-12-04T00:00:00Z,2015,12,Quillichew ER,attention deficit hyperactivity disorder,ALPHA 2 ADRENOCEPTOR AGONIST,DOPAMINE UPTAKE MODULATOR; PSYCHOMODULATOR,ORAL FORMULATION; ORAL SUSTAINED RELEASE FORMULATION; SMALL MOLECULE THERAPEUTIC; TABLET FORMULATION,matched (3),207960,NDA,2015-02-04T00:00:00Z,fda,0,0,0,0,0,,pfizer,NYSE: PFE,1,48851,49605,51584,54657,61035,65165,39490,7646,7690,,,,,,,,1,https://www.accessdata.fda.gov/scripts/cder/daf/index.cfm?event=overview.process&ApplNo=207960,315,34,314,652,"Attention-deficit, conduct, and disruptive behavior disorders",1,0
43,AMPHETAMINE,"DYANAVEL XR; DYANAVEL XR; TRI-102; TRI-102-ADD-001; AMFETAMINE; AMPHETAMINE; AMPHETAMINE (EXTENDED-RELEASE ORAL SUSPENSION/LIQUIXR, ADHD), TRIS","DYANAVEL XR; DYANAVEL XR; TRI-102; TRI-102-ADD-001; AMFETAMINE; AMPHETAMINE; AMPHETAMINE (EXTENDED-RELEASE ORAL SUSPENSION/LIQUIXR, ADHD), TRIS",AMPHETAMINE,DYANAVEL XR,DYANAVEL XR,TRI-102,TRI-102-ADD-001,AMFETAMINE,AMPHETAMINE,"AMPHETAMINE (EXTENDED-RELEASE ORAL SUSPENSION/LIQUIXR, ADHD), TRIS",,,,,,,,,,,,,,,,,,,,,,,,208147,AMPHETAMINE,208147,AMPHETAMINE,,,,,,,,,,,,,,,,,,,2015-10-19T00:00:00Z,2015,10,Dynavel XR,attention deficit hyperactivity disorder,ADRENOCEPTOR AGONIST,HYPOGLYCEMIC AGENT; NEUROPROTECTANT,ORAL FORMULATION; ORAL SUSPENSION FORMULATION; ORAL SUSTAINED RELEASE FORMULATION; SMALL MOLECULE THERAPEUTIC,matched (3),208147,NDA,2014-12-18T00:00:00Z,fda,0,0,0,0,0,,tris pharma,private,0,,,,,,,,,,,,,,,,,1,https://www.accessdata.fda.gov/scripts/cder/daf/index.cfm?event=overview.process&ApplNo=208147,330,34,314,652,"Attention-deficit, conduct, and disruptive behavior disorders",1,0
476,"METHYLPHENIDATE (TRANSDERMAL), SHIRE/NOVEN","DAYTRANA; MTS; METHYPATCH; SPD-485; METHYLPHENIDATE; METHYLPHENIDATE (TRANSDERMAL), SHIRE/NOVEN; TRANSDERMAL METHYLPHENIDATE, SHIRE/ NOVEN","DAYTRANA; MTS; METHYPATCH; SPD-485; METHYLPHENIDATE; METHYLPHENIDATE (TRANSDERMAL), SHIRE/NOVEN; TRANSDERMAL METHYLPHENIDATE, SHIRE/ NOVEN","METHYLPHENIDATE (TRANSDERMAL), SHIRE/NOVEN",DAYTRANA,MTS,METHYPATCH,SPD-485,METHYLPHENIDATE,"METHYLPHENIDATE (TRANSDERMAL), SHIRE/NOVEN","TRANSDERMAL METHYLPHENIDATE, SHIRE/ NOVEN",,,,,,,,,,,,,,,,,,,,,,,,21514,METHYLPHENIDATE,,,,,,,,,,,,,,,,,,,,,2006-04-06T00:00:00Z,2006,4,Daytrana,attention deficit hyperactivity disorder,ALPHA 2 ADRENOCEPTOR MODULATOR,CNS MODULATOR; DOPAMINE UPTAKE INHIBITOR; NOREPINEPHRINE UPTAKE INHIBITOR; PSYCHOMODULATOR,PATCH FORMULATION; SMALL MOLECULE THERAPEUTIC; SUSTAINED RELEASE FORMULATION; TRANSDERMAL FORMULATION,matched (3),021514,NDA,2000-06-27T00:00:00Z,fda,0,0,0,0,0,,noven pharmaceuticals,NASDAQ: NOVN,1,60.7,52.5,45.9,43.2,55.4,45.9,24.2,11.5,11.5,,,,,acquired by hisamitsu in 2009,,,0,https://www.accessdata.fda.gov/scripts/cder/daf/index.cfm?event=overview.process&ApplNo=021514,371,34,314,652,"Attention-deficit, conduct, and disruptive behavior disorders",1,0
437,LISDEXAMFETAMINE,"ADUVANZ; ELVANSE; LDX; LDX-2; NRP-104; S-877489; SPD-489; TYVENSE; VENVANSE; VYVANSE; DEXTROAMPHETAMINE PRODRUG (ADHD), NEW RIVER; DEXTROAMPHETAMINE PRODRUG (ADHD), SHIRE; LISDEXAMFETAMINE; LISDEXAMFETAMINE DIMESYLATE","ADUVANZ; ELVANSE; LDX; LDX-2; NRP-104; S-877489; SPD-489; TYVENSE; VENVANSE; VYVANSE; DEXTROAMPHETAMINE PRODRUG (ADHD), NEW RIVER; DEXTROAMPHETAMINE PRODRUG (ADHD), SHIRE; LISDEXAMFETAMINE; LISDEXAMFETAMINE DIMESYLATE",LISDEXAMFETAMINE,ADUVANZ,ELVANSE,LDX,LDX-2,NRP-104,S-877489,SPD-489,TYVENSE,VENVANSE,VYVANSE,"DEXTROAMPHETAMINE PRODRUG (ADHD), NEW RIVER","DEXTROAMPHETAMINE PRODRUG (ADHD), SHIRE",LISDEXAMFETAMINE,LISDEXAMFETAMINE DIMESYLATE,,,,,,,,,,,,,,,,,21977,LISDEXAMFETAMINE DIMESYLATE,,,,,,,,,,,,,,,,,,,,,2007-02-23T00:00:00Z,2007,2,Vyvanse,attention deficit hyperactivity disorder,,ANTIDEPRESSANT; CNS MODULATOR; DOPAMINE RELEASE STIMULATOR; DOPAMINE UPTAKE INHIBITOR; NORADRENALINE RELEASE STIMULATOR; NOREPINEPHRINE UPTAKE INHIBITOR; PSYCHOSTIMULANT,BUCCAL FORMULATION SYSTEMIC; CAPSULE FORMULATION; DAILY DOSING; ORAL FORMULATION; PRODRUG; SMALL MOLECULE THERAPEUTIC; TABLET FORMULATION,matched (3),021977,NDA,2005-12-06T00:00:00Z,fda,0,0,0,0,0,,shire,NASDAQ: SHPG,1,2436.3,34.3,,,,,2116,544.6,544.6,,,2007,,acquired by shire in 2007,,,1,https://www.accessdata.fda.gov/scripts/cder/daf/index.cfm?event=overview.process&ApplNo=021977,422,34,314,652,"Attention-deficit, conduct, and disruptive behavior disorders",1,0
342,"GUANFACINE HYDROCHLORIDE (EXTENDED-RELEASE, ORAL, ATTENTION DEFICIT HYPERACTIVITY DISEASE/ ADHD), SHIRE","CONNEXYN; CONNEXYN; INTUNIV; INTUNIV XR; S-877503; S-877503; SHP-503; SPD-503; GUANFACINE; GUANFACINE HYDROCHLORIDE; GUANFACINE HYDROCHLORIDE (EXTENDED-RELEASE, ORAL, ATTENTION DEFICIT HYPERACTIVITY DISEASE/ ADHD), SHIRE","CONNEXYN; CONNEXYN; INTUNIV; INTUNIV XR; S-877503; S-877503; SHP-503; SPD-503; GUANFACINE; GUANFACINE HYDROCHLORIDE; GUANFACINE HYDROCHLORIDE (EXTENDED-RELEASE, ORAL, ATTENTION DEFICIT HYPERACTIVITY DISEASE/ ADHD), SHIRE","GUANFACINE HYDROCHLORIDE (EXTENDED-RELEASE, ORAL, ATTENTION DEFICIT HYPERACTIVITY DISEASE/ ADHD), SHIRE",CONNEXYN,CONNEXYN,INTUNIV,INTUNIV XR,S-877503,S-877503,SHP-503,SPD-503,GUANFACINE,GUANFACINE HYDROCHLORIDE,"GUANFACINE HYDROCHLORIDE (EXTENDED-RELEASE, ORAL, ATTENTION DEFICIT HYPERACTIVITY DISEASE/ ADHD), SHIRE",,,,,,,,,,,,,,,,,,,,22037,GUANFACINE HYDROCHLORIDE,,,,,,,,,,,,,,,,,,,,,2009-09-02T00:00:00Z,2009,9,Intuniv,attention deficit hyperactivity disorder,ALPHA 2A ADRENOCEPTOR AGONIST,ANXIOLYTIC; NORADRENALINE RELEASE MODULATOR; PSYCHOMODULATOR,DAILY DOSING; ORAL FORMULATION; ORAL SUSTAINED RELEASE FORMULATION; SMALL MOLECULE THERAPEUTIC; TABLET FORMULATION,matched (3),022037,NDA,2006-08-24T00:00:00Z,fda,0,0,0,0,0,,shire,NASDAQ: SHPG,1,3007.7,3022.2,2436.3,1796.5,1599.3,1363.2,2631.7,639.9,639.9,,,,,,,,0,https://www.accessdata.fda.gov/scripts/cder/daf/index.cfm?event=overview.process&ApplNo=022037,448,34,314,652,"Attention-deficit, conduct, and disruptive behavior disorders",1,0
707,TASIMELTEON,"BMS-214778; HETLIOZ; MA-1; VEC-162; DUAL MT1/MT2 MELATONIN RECEPTOR AGONIST (ORAL, INSOMNIA), BRISTOL-MYERS SQUIBB; DUAL MT1/MT2 MELATONIN RECEPTOR AGONIST (ORAL, INSOMNIA), VANDA; TASIMELTEON","BMS-214778; HETLIOZ; MA-1; VEC-162; DUAL MT1/MT2 MELATONIN RECEPTOR AGONIST (ORAL, INSOMNIA), BRISTOL-MYERS SQUIBB; DUAL MT1/MT2 MELATONIN RECEPTOR AGONIST (ORAL, INSOMNIA), VANDA; TASIMELTEON",TASIMELTEON,BMS-214778,HETLIOZ,MA-1,VEC-162,"DUAL MT1/MT2 MELATONIN RECEPTOR AGONIST (ORAL, INSOMNIA), BRISTOL-MYERS SQUIBB","DUAL MT1/MT2 MELATONIN RECEPTOR AGONIST (ORAL, INSOMNIA), VANDA",TASIMELTEON,,,,,,,,,,,,,,,,,,,,,,,,205677,TASIMELTEON,,,,,,,,,,,,,,,,,,,,,2014-01-31T00:00:00Z,2014,1,Hetlioz,circadian rhythm sleep disorder,MELATONIN MT1 AGONIST; MELATONIN MT2 AGONIST,ANTIDEPRESSANT; HYPNOTIC,CAPSULE FORMULATION; LIQUID FORMULATION; ORAL FORMULATION; SMALL MOLECULE THERAPEUTIC,matched (3),205677,NDA,2013-05-31T00:00:00Z,fda,1,0,0,1,0,,vanda pharmaceuticals,NASDAQ: VNDA,1,50.2,33.9,32.7,31.3,35.7,4.5,48.6,19.2,19.2,,,,,,,,0,https://www.accessdata.fda.gov/scripts/cder/daf/index.cfm?event=overview.process&ApplNo=205677,249,2392,327,259,Residual codes; unclassified,3,0
61,ARMODAFINIL,"CEP-10953; NUVIGIL; R-ISOMER MODAFINIL, CEPHALON; R-MODAFINIL; ARMODAFINIL","CEP-10953; NUVIGIL; R-ISOMER MODAFINIL, CEPHALON; R-MODAFINIL; ARMODAFINIL",ARMODAFINIL,CEP-10953,NUVIGIL,"R-ISOMER MODAFINIL, CEPHALON",R-MODAFINIL,ARMODAFINIL,,,,,,,,,,,,,,,,,,,,,,,,,,21875,ARMODAFINIL,,,,,,,,,,,,,,,,,,,,,2007-06-15T00:00:00Z,2007,6,Nuvigil,obstructive sleep apnea,ALPHA 1 ADRENOCEPTOR AGONIST; DOPAMINE TRANSPORTER INHIBITOR,PSYCHOSTIMULANT,ORAL FORMULATION; SMALL MOLECULE THERAPEUTIC; STEREOCHEMISTRY; TABLET FORMULATION,matched (3),021875,NDA,2005-03-31T00:00:00Z,fda,0,0,0,0,0,,cephalon,NASDAQ: CEPH,1,1772.6,1764.1,1211.9,1015.4,714.8,506.9,1426.9,369.1,369.1,,,,,acquired by teva in 2011,,,0,https://www.accessdata.fda.gov/scripts/cder/daf/index.cfm?event=overview.process&ApplNo=021875,398,3519,327,259,Residual codes; unclassified,3,0
